X,Y,OBJECTID,FD_ID,DEPT_NAME,STATION_NUMBER,STATION_ADDRESS,CITY,STATE,COUNTY,ZIP_CODE,LATITUDE,LONGITUDE
-82.34584251,35.38905408,23396,4504,"Edneyville Volunteer Fire and Rescue Department, Inc.",1,1 Firehouse Drive,Hendersonville,NC,Henderson,28792,35.39,-82.35
-82.3941,35.3951,23397,4504,"Edneyville Volunteer Fire and Rescue Department, Inc.",2,3101 Fruitland Road,Hendersonville,NC,Henderson,28792,35.40,-82.39
-82.31034099,35.38149304,23398,4504,"Edneyville Volunteer Fire and Rescue Department, Inc.",3,21 SugarLoaf Mountain Road,Hendersonville,NC,Henderson,28792,35.38,-82.31
-79.17807166,36.08080867,23399,6803,"Efland Volunteer Fire Company, Inc.",1,3900 US 70 W,Efland,NC,Orange,27243,36.08,-79.18
-79.21689615,36.08709537,23400,6803,"Efland Volunteer Fire Company, Inc.",2,5800 US Hwy 70,Mebane,NC,Orange,27302,36.09,-79.22
-79.1838,36.1207,23401,6803,"Efland Volunteer Fire Company, Inc.",3,4111 Harmony Church Road,Efland,NC,Orange,27243,36.12,-79.18
-82.3926,35.9921,23402,10015,"Egypt - Ramseytown Volunteer Fire Department, Inc.",1,8635 US Hwy 19 W,Burnsville,NC,Yancey,28714,35.99,-82.39
-82.34712781,36.0084927,23403,10015,"Egypt - Ramseytown Volunteer Fire Department, Inc.",2,14530 US Hwy 19 W,Burnsville,NC,Yancey,28714,36.01,-82.35
-78.52839271,35.45415681,23404,5111,"Elevation Fire Department, Incorporated",1,1825 Federal Rd,Benson,NC,Johnston,27504,35.45,-78.53
-79.30644595,35.90609131,23405,104,"Eli Whitney Volunteer Fire Department, Inc.",1,7618 Hwy NC 87 South,Graham,NC,Alamance,27253,35.91,-79.31
-79.37579959,35.96704762,23406,104,"Eli Whitney Volunteer Fire Department, Inc.",2,4606 Hwy 87 South,Graham,NC,Alamance,27253,35.97,-79.38
-76.24071265,36.28761516,23407,7001,Elizabeth City Fire Department,1,902 Halstead Blvd,Elizabeth City,NC,Pasquotank,27909,36.29,-76.24
-76.22510461,36.30509568,23408,7001,Elizabeth City Fire Department,2,410 Harney St,Elizabeth City,NC,Pasquotank,27909,36.31,-76.23
-78.604287,34.627747,23409,904,Elizabethtown Fire Department,1,300 East Broad St,Elizabethtown,NC,Bladen,28337,34.63,-78.60
-78.6114,34.6275,23410,904,Elizabethtown Fire Department,2,401 West Swanzy St.,Elizabethtown,NC,Bladen,28337,34.63,-78.61
-81.98211843,36.1580739,23411,607,"Elk Park Volunteer Fire Department, Inc.",1,7771 N. US 19-E,Elk Park,NC,Avery,28622,36.16,-81.98
-80.85562758,36.24670433,23412,8616,Elkin Fire Department,1,304 North Front Street,Elkin,NC,Surry,28621,36.25,-80.86
-81.75823178,35.32705318,23413,8104,"Ellenboro Volunteer Fire Department, Inc.",1,175 Depot St,Ellenboro,NC,Rutherford,28040,35.33,-81.76
-81.26202875,35.92123902,23414,202,"Ellendale Community Volunteer Fire Department, Inc.",1,30 Ellendale Road,Taylorsville,NC,Alexander,28681,35.92,-81.26
-79.7619586,35.0715,23415,7702,Ellerbe Fire Department,1,108 West Page Street,Ellerbe,NC,Richmond,28338,35.07,-79.76
-80.4649,35.7252,23416,8048,"Ellis Cross-Country Fire Department, Inc.",1,3420 Old Mocksville Road,Salisbury,NC,Rowan,28144,35.73,-80.46
-79.50678274,36.09779133,23417,105,Elon Fire / Rescue,1,219 South Williamson Ave.,Elon,NC,Alamance,27244,36.10,-79.51
-79.49570536,36.11209198,23418,105,Elon Fire / Rescue,2,2110 Power Line Road,Elon,NC,Alamance,27244,36.11,-79.50
-77.9022,35.3397,23419,9606,"Elroy Volunteer Fire Fighters, Incorporated",1,4720 Hwy 70 East,Goldsboro,NC,Wayne,27534,35.34,-77.90
-77.8811,35.2899,23420,9606,"Elroy Volunteer Fire Fighters, Incorporated",2,1561 Dollard Town Rd,Goldsboro,NC,Wayne,27534,35.29,-77.88
-77.02920132,34.66630962,23421,1645,Emerald Isle Fire Department,1,7516 Emerald Isle Dr.,Emerald Isle,NC,Carteret,28594,34.67,-77.03
-76.95891562,34.67712343,23422,1645,Emerald Isle Fire Department,2,2810 Emerald Dr.,Emerald Isle,NC,Carteret,28594,34.68,-76.96
-80.2796,35.3048,23423,8408,"Endy Volunteer Fire Department, Incorporated",1,25045 24/27 Hwy,Albemarle,NC,Stanly,28001,35.30,-80.28
-77.68007813,36.18146454,23424,4203,"Enfield Fire Department, Inc.",1,12719 NC Hwy 481 Business,Enfield,NC,Halifax,27823,36.18,-77.68
-77.8304949,36.21643076,23425,4203,"Enfield Fire Department, Inc.",2,9768 Ringwood Rd.,Enfield,NC,Halifax,27823,36.22,-77.83
-76.00704636,35.51026987,23426,4801,"Engelhard Volunteer Fire Department, Inc.",1,34545 US 264,Engelhard,NC,Hyde,27824,35.51,-76.01
-82.68446052,35.53953968,23427,1106,"Enka Candler Fire and Rescue Department, Incorporated",1,85 Pisgah Hwy.,Candler,NC,Buncombe,28715,35.54,-82.68
-82.7427,35.5426,23428,1106,"Enka Candler Fire and Rescue Department, Incorporated",2,2332 Smokey Park Hwy.,Candler,NC,Buncombe,28715,35.54,-82.74
-82.64018,35.5434,23429,1106,"Enka Candler Fire and Rescue Department, Incorporated",3,125 Jacob Holm Way,Candler,NC,Buncombe,28715,35.54,-82.64
-79.0139,36.0397,23430,6804,"Eno Fire and Emergency Services, Inc.",1,5019 US 70 East,Durham,NC,Orange,27705,36.04,-79.01
-79.003,36.1155,23431,6804,"Eno Fire and Emergency Services, Inc.",2,5501 St Mary Road,Hillsborough,NC,Orange,27278,36.12,-79.00
-80.66686437,35.53055568,23432,8049,"Enochville Fire and Rescue Department, Inc.",1,808 N. Enochville Ave,China Grove,NC,Rowan,28023,35.53,-80.67
-81.64997207,35.6621954,23433,1259,Enola Volunteer Fire Rescue,1,2559 Enola Road,Morganton,NC,Burke,28655,35.66,-81.65
-78.32545825,36.24236588,23434,3511,"Epsom Fire and Rescue Association, Incorporated, Henderson, North Carolina",1,8120 Hwy 39 South ,Henderson,NC,Franklin,27537,36.24,-78.33
-78.67646478,35.32668992,23435,4307,"Erwin Fire Department and Rescue Squad, Inc.",1,200 South 13th St,Erwin,NC,Harnett,28339,35.33,-78.68
-82.57840688,35.32503474,23436,4505,"Etowah-Horseshoe Volunteer Fire & Rescue Department, Inc.",1,15 Morgan Road,Etowah,NC,Henderson,28729,35.33,-82.58
-82.55807854,35.30328479,23437,4505,"Etowah-Horseshoe Volunteer Fire & Rescue Department, Inc.",2,3559 Hebron Road,Hendersonville,NC,Henderson,28739,35.30,-82.56
-82.5445,35.3406,23438,4505,"Etowah-Horseshoe Volunteer Fire & Rescue Department, Inc.",3,3712 Brevard Road,Hendersonville,NC,Henderson,28792,35.34,-82.54
-82.61410385,35.32000236,23439,4505,"Etowah-Horseshoe Volunteer Fire & Rescue Department, Inc.",4,744 Brickyard Road,Etowah,NC,Henderson,28729,35.32,-82.61
-76.85310344,36.4271331,23440,3704,"Eure Volunteer Fire Department, Inc.",1,1210 Hwy 137,Eure,NC,Gates,27935,36.43,-76.85
-79.29204099,34.67382721,23441,7806,"Evans Cross Road Voluntary Fire Department, Inc.",1,3440 Elrod Rd.,Maxton,NC,Robeson,28364,34.67,-79.29
-78.9048,34.4094,23442,2407,Evergreen Volunteer Fire Dept.,1,7606 Old 74 Hwy,Evergreen,NC,Columbus,28438,34.41,-78.90
-78.847678,34.431681,23443,2407,Evergreen Volunteer Fire Dept.,2,850 Rossie O'Berry Rd,Whiteville,NC,Columbus,28472,34.43,-78.85
-79.020315,34.31981,23444,2408,"Fair Bluff Fire Department and Rescue Squad, Inc.",1,152 Main St.,Fair Bluff,NC,Columbus,28439,34.32,-79.02
-78.97157854,34.24068026,23445,2408,"Fair Bluff Fire Department and Rescue Squad, Inc.",2,185 Mc Neill Rd,Fair Bluff,NC,Columbus,28439,34.24,-78.97
-80.07799079,35.85018696,23446,2905,"Fair Grove Fire Department, Inc.",1,211 Cedar Lodge Road,Thomasville,NC,Davidson,27360,35.85,-80.08
-80.0284586,35.86234348,23447,2905,"Fair Grove Fire Department, Inc.",2,7261 Welborne,Trinity,NC,Davidson,27370,35.86,-80.03
-80.0859,35.81038559,23448,2905,"Fair Grove Fire Department, Inc.",3,760 Lee Road,Thomasville,NC,Davidson,27360,35.81,-80.09
-82.18825953,35.46220839,23449,8115,"Fairfield Mountains Volunteer Fire Department, Inc.",1,1415 Buffalo Creek Rd,Lake Lure,NC,Rutherford,28746,35.46,-82.19
-76.22241224,35.53746944,23450,4805,Fairfield Volunteer Fire Department,1,6680 NC 94,Fairfield,NC,Hyde,27826,35.54,-76.22
-79.11328357,34.49444162,23451,7807,Fairmont Fire Department,1,103 Cottage St.,Fairmont,NC,Robeson,28340,34.49,-79.11
-79.1105586,34.49606737,23452,7808,"Fairmont Rural Fire Department, Incorporated",1,203 Mulberry St,Fairmont,NC,Robeson,28340,34.50,-79.11
-80.53719271,35.13585084,23453,9004,Fairview Fire & Rescue Association,1,7402 Concord Highway,Monroe,NC,Union,28110,35.14,-80.54
-78.77001761,35.69416971,23454,9206,"Fairview Rural Fire Department, Inc.",1,4501 Ten-Ten Rd,Apex,NC,Wake,27502,35.69,-78.77
-78.7075,35.6722,23455,9206,"Fairview Rural Fire Department, Inc.",2,7401 Ten-Ten Rd ,Apex,NC,Wake,27502,35.67,-78.71
-82.39768542,35.51526113,23456,1107,"Fairview Volunteer Fire Department, Incorporated (Buncombe County)",1,1586 Charlotte Hwy.,Fairview,NC,Buncombe,28730,35.52,-82.40
-82.38247662,35.5432258,23457,1107,"Fairview Volunteer Fire Department, Incorporated (Buncombe County)",2,799 Old Fort Road,Fairview,NC,Buncombe,28730,35.54,-82.38
-82.42713983,35.48151529,23458,1107,"Fairview Volunteer Fire Department, Incorporated (Buncombe County)",3,133 Upper Brush Creek Rd.,Fletcher,NC,Buncombe,28732,35.48,-82.43
-78.13649656,35.11612633,23459,3106,"Faison Fire and Rescue, Inc.",1,108 South West Center St,Faison,NC,Duplin,28341,35.12,-78.14
-80.46347125,35.58767315,23460,8054,Faith Fire Department,1,"1005 Raney St. Faith, NC",Faith,NC,Rowan,28041,35.59,-80.46
-77.51687813,35.69931287,23461,7412,"Falkland Volunteer Fire Department, Inc.",1,3620 West Ave.,Falkland,NC,Pitt,27827,35.70,-77.52
-77.463822,35.649596,23462,7412,"Falkland Volunteer Fire Department, Inc.",2,4207 NC 43 North,Falkland,NC,Pitt,27827,35.65,-77.46
-81.93732752,36.2051727,23463,608,"Fall Creek Volunteer Fire Department of Avery County, Inc.",1,4296 Beech Mountain Rd,Elk Park,NC,Avery,28622,36.21,-81.94
-81.90003102,36.24658259,23464,608,"Fall Creek Volunteer Fire Department of Avery County, Inc.",2,2525 Buckeye Rd,Elk Park,NC,Avery,28622,36.25,-81.90
-78.5794,35.9339,23465,9207,"Falls Volunteer Fire Department, Inc.",1,11908 Falls of Neuse Rd,Wake Forest,NC,Wake,27587,35.93,-78.58
-81.5006,35.4248,23466,2308,"Fallston Community Volunteer Fire Department, Inc.",1,4632 Fallston Rd.,Fallston,NC,Cleveland,28042,35.42,-81.50
-81.5206,35.47995,23467,2308,"Fallston Community Volunteer Fire Department, Inc.",2,142 Carpenters Grove Church Road,Lawndale,NC,Cleveland,28090,35.48,-81.52
-79.99607854,35.63952098,23468,7604,"Farmer Volunteer Fire Department, Inc.",1,6881 S Old NC 49 Hwy,Denton,NC,Randolph,27239,35.64,-80.00
-77.5847291,35.59762116,23469,7418,Farmville Fire Department,1,3713 N Main St,Farmville,NC,Pitt,27828,35.60,-77.58
-77.585,35.5978,23470,7453,"Farmville Rural Fire Association, Inc.",1,3713 N Main St.,Farmville,NC,Pitt,27828,35.60,-77.59
-77.8462,35.5125,23471,9608,"Faro V.F.District, Inc.",1,1183 Faro Rd,Fremont,NC,Wayne,27830,35.51,-77.85
-79.41466052,36.13323536,23472,106,"Faucette Township Volunteer Fire Department, Inc.",1,2164 Carolina Road,Burlington,NC,Alamance,27217,36.13,-79.41
-79.46001569,36.15175631,23473,106,"Faucette Township Volunteer Fire Department, Inc.",2,3173 Mansfield Rd,Burlington,NC,Alamance,27217,36.15,-79.46
-78.86655213,35.04893175,23474,2607,Fayetteville Fire Department,1,607 Person St.,Fayetteville,NC,Cumberland,28301,35.05,-78.87
-78.90128886,35.0575024,23475,2607,Fayetteville Fire Department,2,101 N. Olive St,Fayetteville,NC,Cumberland,28301,35.06,-78.90
-78.89784142,35.10178589,23476,2607,Fayetteville Fire Department,3,3225 Rose Hill Rd,Fayetteville,NC,Cumberland,28301,35.10,-78.90
-78.92349079,35.07106488,23477,2607,Fayetteville Fire Department,4,406 Stamper Rd,Fayetteville,NC,Cumberland,28303,35.07,-78.92
-78.92675364,35.02992842,23478,2607,Fayetteville Fire Department,5,3040 Boone Trail Ext.,Fayetteville,NC,Cumberland,28303,35.03,-78.93
-78.9512,35.0594,23479,2607,Fayetteville Fire Department,6,4439 Cliffdale Rd,Fayetteville,NC,Cumberland,28303,35.06,-78.95
-78.88503603,35.13143148,23480,2607,Fayetteville Fire Department,7,301 Stacey Weaver Rd,Fayetteville,NC,Cumberland,28311,35.13,-78.89
-79.01213528,35.0528096,23481,2607,Fayetteville Fire Department,8,1116 71st School Rd,Fayetteville,NC,Cumberland,28314,35.05,-79.01
-78.98557166,35.08783128,23482,2607,Fayetteville Fire Department,9,5091 Santa Fe Dr,Fayetteville,NC,Cumberland,28314,35.09,-78.99
-78.88548542,34.99130663,23483,2607,Fayetteville Fire Department,10,3059 Control Tower Rd,Fayetteville,NC,Cumberland,28306,34.99,-78.89
-79.05216781,35.03096033,23484,2607,Fayetteville Fire Department,11,7690 Raeford Rd,Fayetteville,NC,Cumberland,28314,35.03,-79.05
-78.9606,35.0319,23485,2607,Fayetteville Fire Department,12,911 Hope Mills Rd,Fayetteville,NC,Cumberland,28314,35.03,-78.96
-78.89442531,35.07797755,23486,2607,Fayetteville Fire Department,14,632 Langdon St,Fayetteville,NC,Cumberland,28301,35.08,-78.89
-79.05635289,35.05748803,23487,2607,Fayetteville Fire Department,15,8434 Cliffdale Rd,Fayetteville,NC,Cumberland,28314,35.06,-79.06
-78.84265364,35.02469896,23488,2607,Fayetteville Fire Department,16,1126 Cedar Creek Rd,Fayetteville,NC,Cumberland,28312,35.02,-78.84
-78.99582531,35.02318706,23489,2607,Fayetteville Fire Department,17,6701 Bailey Lake Rd,Fayetteville,NC,Cumberland,28314,35.02,-79.00
-78.89222959,35.15458746,23490,2607,Fayetteville Fire Department,19,3481 Walsh Parkway,Fayetteville,NC,Cumberland,28311,35.15,-78.89
-77.8998,34.062,23491,6512,"Federal Point Fire-Rescue,Inc.",1,9815 River Rd,Wilmington,NC,New Hanover,28412,34.06,-77.90
-81.37125102,36.08483989,23492,9723,"Ferguson Volunteer Fire Department, Inc.",1,12660 W. NC 268 Hwy. ,Ferguson,NC,Wilkes,28624,36.08,-81.37
-81.49545364,36.12110467,23493,9723,"Ferguson Volunteer Fire Department, Inc.",2,7262 Elk Creek - Darby Rd.,Ferguson,NC,Wilkes,28624,36.12,-81.50
-78.1777,35.8598,23494,6405,"Ferrells Volunteer Fire and Rescue Department, Inc.",1,9589 West NC 97 Highway,Middlesex,NC,Nash,27557,35.86,-78.18
-82.9553,35.6825,23495,4414,"Fines Creek Volunteer Fire Department, Inc.",1,244 Fines Creek Road,Clyde,NC,Haywood,28721,35.68,-82.96
-79.56978583,36.16035669,23496,4108,"Fire District #28, Inc.",1,6619 NC Hwy 61 North,Gibsonville,NC,Guilford,27249,36.16,-79.57
-79.75430536,36.14909604,23497,4106,"Fire District Number Thirteen, Incorporated",1,2505 Lees Chapel Rd,Greensboro,NC,Guilford,27405,36.15,-79.75
-79.71323219,36.15304332,23498,4106,"Fire District Number Thirteen, Incorporated",2,4629 Hicone Rd.,Greensboro,NC,Guilford,27405,36.15,-79.71
-79.7927,36.1919,23499,4106,"Fire District Number Thirteen, Incorporated",3,6912 Spencer Dixson Rd.,Greensboro,NC,Guilford,27455,36.19,-79.79
-78.10616245,36.18665587,23500,3502,"Fire and Rescue Association, Incorporated, Centerville, North Carolina",1,5939 NC 561 ,Louisburg,NC,Franklin,27549,36.19,-78.11
-78.88315364,35.31241615,23501,4308,"Flat Branch Volunteer Fire Department, Inc.",1,2098 Elliot Bridge,Bunnlevel,NC,Harnett,28323,35.31,-78.88
-78.7998,35.3577,23502,4309,"Flatwoods Community Fire Department, Inc.",1,3130 US Hwy 401 S,Lillington,NC,Harnett,27546,35.36,-78.80
-81.509609,36.310744,23503,507,"Fleetwood Volunteer Fire and Rescue Department,Inc.",1,9026 Highway 221 South,Fleetwood,NC,Ashe,28626,36.31,-81.51
-82.500282,35.431101,23504,4506,"Fletcher Fire and Rescue Department, Inc.",1,49 East Fanning Bridge Rd.,Fletcher,NC,Henderson,28732,35.43,-82.50
-82.4426,35.4376,23505,4506,"Fletcher Fire and Rescue Department, Inc.",2,458 Hoopers Creek Road,Fletcher,NC,Henderson,28732,35.44,-82.44
-82.5027,35.3894,23506,4506,"Fletcher Fire and Rescue Department, Inc.",3,5399 Asheville Hwy.,Hendersonville,NC,Henderson,28791,35.39,-82.50
-76.6517337,35.14345963,23507,6909,"Florence-Whortonsville Volunteer Fire Department, Inc.",1,5208 Florence Rd.,Merritt,NC,Pamlico,28556,35.14,-76.65
-80.55813907,35.2979198,23508,1304,"Flowe's Store Volunteer Fire Department, Inc.",1,8623 Flowe's Store Rd.,Concord,NC,Cabarrus,28025,35.30,-80.56
-80.5191,36.1147,23509,9911,"Forbush Volunteer Fire Department, Inc.",1,4725 East Old Hwy 421,Yadkinville,NC,Yadkin,27055,36.11,-80.52
-80.4671,36.1495,23510,9911,"Forbush Volunteer Fire Department, Inc.",2,1340 Flint Hill Rd.,Yadkinville,NC,Yadkin,27055,36.15,-80.47
-82.4796,35.4872,23511,9911,"Forbush Volunteer Fire Department, Inc.",3,310 Williams Road,Fletcher,NC,Yadkin,28732,35.49,-82.48
-82.5245,35.5098,23512,9911,"Forbush Volunteer Fire Department, Inc.",4,7 Valley Springs Road,Asheville,NC,Yadkin,28803,35.51,-82.52
-81.86966781,35.33259738,23513,8105,Forest City Fire Department,1,186 S. Church St,Forest City,NC,Rutherford,28043,35.33,-81.87
-82.17772146,36.05242094,23514,6109,"Fork Mountain Volunteer Fire and Rescue, Inc.",1,2699 Fork Mountain Road,Bakersville,NC,Mitchell,28705,36.05,-82.18
-77.33505129,35.28930901,23515,2505,"Fort Barnwell Rural Volunteer Fire Department, Inc.",1,9327 NC Hwy 55 West,Dover,NC,Craven,28526,35.29,-77.34
-77.41462653,35.32345045,23516,2505,"Fort Barnwell Rural Volunteer Fire Department, Inc.",2,102 William Pierce Rd,Dover,NC,Craven,28526,35.32,-77.41
-77.7751,35.49,23517,4005,Fort Run Rural Fire & Ems Association Inc.,1,2985 Fort Run Rd,Snow Hill,NC,Greene,28580,35.49,-77.78
-81.77641994,36.1568228,23518,9506,"Foscoe Volunteer Fire Department, Inc.",1,9230 Hwy 105 South,Banner Elk,NC,Watauga,28604,36.16,-81.78
-81.76424169,36.21004149,23519,9506,"Foscoe Volunteer Fire Department, Inc.",2,120 Lance Trail,Banner Elk,NC,Watauga,28604,36.21,-81.76
-77.64092875,35.672,23520,7454,"Fountain Rural Fire Association, Inc.",1,3642 Lynch St,Fountain,NC,Pitt,27829,35.67,-77.64
-77.6724,34.8407,23521,3105,Fountaintown Fire Department,1,1698 Fountain Rd,Chinquapin,NC,Duplin,28521,34.84,-77.67
-78.4265249,35.44263059,23522,5113,"Four Oaks Volunteer Fire Department, Inc.",1,100 Keen St,Four Oaks,NC,Johnston,27524,35.44,-78.43
-78.46483685,35.48212137,23523,5113,"Four Oaks Volunteer Fire Department, Inc.",2,825 Lassiter Road,Four Oaks,NC,Johnston,27524,35.48,-78.46
-80.5702,36.5128,23524,8668,"Four-way Volunteer Fire Department, Inc.",1,116 McBride Road,Mount Airy,NC,Surry,27030,36.51,-80.57
-80.6032,36.5493,23525,8668,"Four-way Volunteer Fire Department, Inc.",2,2846  Ward's Gap Road,Mount Airy,NC,Surry,27030,36.55,-80.60
-80.3537,36.5109,23526,8502,"Francisco Volunteer Fire Department, Inc.",1,7100 Hwy 89,Westfield,NC,Stokes,27053,36.51,-80.35
-82.00204099,36.07883581,23527,605,"Frank Volunteer Fire Department, Inc.",1,699 N US 19E Hwy,Newland,NC,Avery,28657,36.08,-82.00
-80.66288735,36.50297807,23528,8671,"Franklin Community Volunteer Fire Department, Inc.",1,2136 W. Pine Street,Mount Airy,NC,Surry,27030,36.50,-80.66
-80.63954711,36.54332761,23529,8671,"Franklin Community Volunteer Fire Department, Inc.",2,1889 Greenhill Road,Mount Airy,NC,Surry,27030,36.54,-80.64
-83.3879,35.1786,23530,5702,Franklin Fire And Rescue Department,1,49 Maple Street,Franklin,NC,Macon,28734,35.18,-83.39
-83.358911,35.21633,23531,5702,Franklin Fire And Rescue Department,2,305 NP&L Loop,Franklin,NC,Macon,28734,35.22,-83.36
-80.49819539,35.72041776,23532,8055,"Franklin Township Fire Department, Incorporated",1,4370 US 601 Hwy,Salisbury,NC,Rowan,28144,35.72,-80.50
-80.55956052,35.71056497,23533,8055,"Franklin Township Fire Department, Incorporated",2,4370 US 70 Hwy,Salisbury,NC,Rowan,28147,35.71,-80.56
-78.45860688,36.10316193,23534,3505,"Franklinton Fire Department, Inc.",1,9 South Hillsboro St.,Franklinton,NC,Franklin,27525,36.10,-78.46
-79.69340688,35.74446517,23535,7605,Franklinville Fire Protection Assn. Inc.,1,146 W. Main St,Franklinville,NC,Randolph,27248,35.74,-79.69
-79.64280035,35.79816084,23536,7605,Franklinville Fire Protection Assn. Inc.,2,2452 Ramseur Julian Rd,Liberty,NC,Randolph,27298,35.80,-79.64
-79.722909,35.784345,23537,7605,Franklinville Fire Protection Assn. Inc.,3,2426 Whites Memorial Road,Franklinville,NC,Randolph,27248,35.78,-79.72
-79.6354663,35.71868241,23538,7605,Franklinville Fire Protection Assn. Inc.,4,1288 NC Hwy 22 South,Ramseur,NC,Randolph,27316,35.72,-79.64
-77.97213947,35.5476389,23539,9610,Fremont Fire Department,1,401 N Sycamore St,Fremont,NC,Wayne,27830,35.55,-77.97
-82.63994332,35.70043505,23540,1108,"French Broad Volunteer Fire & Rescue, Inc.",1,572 Fletcher Martin Road,Alexander,NC,Buncombe,28701,35.70,-82.64
-75.61316636,35.24694305,23541,2810,"Frisco Fire Prevention Association, Inc.",1,52470 NC Hwy 12,Frisco,NC,Dare,27936,35.25,-75.61
-78.79779079,35.58167784,23542,9208,Fuquay-Varina Fire Department,1,301 S Fuquay-Varina Ave ,Fuquay Varina,NC,Wake,27526,35.58,-78.80
-78.72316741,35.61996135,23543,9208,Fuquay-Varina Fire Department,2,5617 Hilltop Rd,Fuquay Varina,NC,Wake,27526,35.62,-78.72
-78.69835516,35.55904763,23544,9208,Fuquay-Varina Fire Department,3,2474 Budd Libscomb Rd ,Willow Spring,NC,Wake,27592,35.56,-78.70
-77.30440192,35.39139125,23545,7445,"Gardnerville Volunteer Fire Department, Inc.",1,9521 County Home Rd,Ayden,NC,Pitt,28513,35.39,-77.30
-78.398075,34.790323,23546,8204,"Garland Volunteer Fire & Rescue Department, Inc.",1,375 West 2nd St.,Garland,NC,Sampson,28441,34.79,-78.40
-78.61336933,35.70955209,23547,9209,"Garner Volunteer Fire-Rescue, Inc.",1,503 West Main St,Garner,NC,Wake,27529,35.71,-78.61
-78.6411249,35.63064825,23548,9209,"Garner Volunteer Fire-Rescue, Inc.",2,9115 Sauls Rd,Garner,NC,Wake,27529,35.63,-78.64
-78.6358088,35.69238237,23549,9209,"Garner Volunteer Fire-Rescue, Inc.",3,1695 Timber Dr.,Garner,NC,Wake,27529,35.69,-78.64
-78.5498,35.6775,23550,9209,"Garner Volunteer Fire-Rescue, Inc.",4,125 Spaceway ,Garner,NC,Wake,27529,35.68,-78.55
-82.31611376,35.5591,23551,1123,"Garren Creek Volunteer Fire Department, Inc.",1,10 Flat Creek Road,Fairview,NC,Buncombe,28730,35.56,-82.32
-82.31011761,35.53075239,23552,1123,"Garren Creek Volunteer Fire Department, Inc.",2,1364 Garren Creek Road,Fairview,NC,Buncombe,28730,35.53,-82.31
-77.56615708,36.44920356,23553,6608,"Garysburg Volunteer Fire Department, Inc.",1,506 Old Hwy,Garysburg,NC,Northampton,27831,36.45,-77.57
-77.64598274,36.50362504,23554,6602,"Gaston Volunteer Fire Department, Inc.",1,210 Old Emporia Road,Gaston,NC,Northampton,27832,36.50,-77.65
-77.60397433,36.51743223,23555,6602,"Gaston Volunteer Fire Department, Inc.",2,1524 NC Highway 48,Garysburg,NC,Northampton,27831,36.52,-77.60
-81.22223866,35.26256281,23556,3612,Gastonia Fire Department,1,260 North Myrtle School Road,Gastonia,NC,Gaston,28052,35.26,-81.22
-81.18910344,35.27858393,23557,3612,Gastonia Fire Department,2,510 New Way Drive,Gastonia,NC,Gaston,28052,35.28,-81.19
-81.1725,35.2438,23558,3612,Gastonia Fire Department,3,717 Wellons Drive,Gastonia,NC,Gaston,28056,35.24,-81.17
-81.1347,35.2406,23559,3612,Gastonia Fire Department,4,900 Armstrong Park Road,Gastonia,NC,Gaston,28054,35.24,-81.13
-81.2024,35.2353,23560,3612,Gastonia Fire Department,5,900 Hudson Boulevard,Gastonia,NC,Gaston,28052,35.24,-81.20
-81.16200729,35.27048759,23561,3612,Gastonia Fire Department,6,1335 East Ozark Street,Gastonia,NC,Gaston,28054,35.27,-81.16
-81.13507166,35.22138258,23562,3612,Gastonia Fire Department,7,3811 Gaston Day School Road,Gastonia,NC,Gaston,28056,35.22,-81.14
-81.25255143,35.24594349,23563,3612,Gastonia Fire Department,8,613 Carson Road,Gastonia,NC,Gaston,28052,35.25,-81.25
-76.76949067,36.50361271,23564,3701,"Gates Volunteer Fire Department, Inc.",1,459 Gates School Rd.,Gates,NC,Gates,27937,36.50,-76.77
-76.75151417,36.40271727,23565,3702,Gatesville Fire Department,1,127 Main St.,Gatesville,NC,Gates,27938,36.40,-76.75
-81.50407166,35.65056975,23566,1273,George Hildebran Fire and Rescue Department Inc.,1,7470 George Hildebran School Road,Connelly Springs,NC,Burke,28612,35.65,-81.50
-80.4596,35.3129,23567,1305,"Georgeville Volunteer Fire Department, Inc.",1,6916 NC 200 Hwy,Concord,NC,Cabarrus,28025,35.31,-80.46
-82.34698735,35.478385,23568,4511,"Gerton Volunteer Fire Department and Rescue, Inc.",1,4975 Gerton Highway,Gerton,NC,Henderson,28735,35.48,-82.35
-79.5949923,34.76259456,23569,8301,"Gibson/Southwest District Fire Department, Inc.",1,6280 Gibson Rd,Gibson,NC,Scotland,28343,34.76,-79.59
-79.53995668,36.10710803,23570,4109,Gibsonville Fire Dept.,1,218 Piedmont Ave,Gibsonville,NC,Guilford,27249,36.11,-79.54
-80.9154,35.424,23571,6008,"Gilead Volunteer Fire and Rescue Department, Inc.",1,15600 Beaties Ford Road,Huntersville,NC,Mecklenburg,28078,35.42,-80.92
-80.97779312,36.49976978,23572,302,"Glade Creek Volunteer Fire Department, Incorporated",1,6374 Glade Valley Rd.  ,Ennice,NC,Alleghany,28623,36.50,-80.98
-81.77902146,35.7293658,23573,1269,Glen Alpine Volunteer Fire Department,1,104 Catawba Street,Glen Alpine,NC,Burke,28628,35.73,-81.78
-81.3809,36.3442,23574,506,"Glendale Springs Volunteer Fire Department, Inc.",1,7479 Hwy 16 South,Jefferson ,NC,Ashe,28629,36.34,-81.38
-81.98149959,35.61190467,23575,5603,Glenwood Volunteer Fire Department,1,1745 Old Highway 221 South,Marion,NC,McDowell,28752,35.61,-81.98
-78.659032,35.198332,23576,2606,"Godwin-Falcon Fire Department, Inc.",1,7723 Godwin Falcon Rd,Falcon,NC,Cumberland,28342,35.20,-78.66
-78.19385364,36.20720866,23577,3512,"Gold Sand Rural Fire Department, Inc.",1,2295 Person Rd,Louisburg,NC,Franklin,27549,36.21,-78.19
-77.99770729,35.38046382,23578,9611,Goldsboro Fire Department,1,204 South Center St.,Goldsboro,NC,Wayne,27530,35.38,-78.00
-77.96288698,35.3872996,23579,9611,Goldsboro Fire Department,2,1901 Royal Ave,Goldsboro,NC,Wayne,27534,35.39,-77.96
-77.98238123,35.40941835,23580,9611,Goldsboro Fire Department,3,100 E Patetown Rd,Goldsboro,NC,Wayne,27530,35.41,-77.98
-77.98716589,35.36459877,23581,9611,Goldsboro Fire Department,4,1300 Poplar St,Goldsboro,NC,Wayne,27530,35.36,-77.99
-77.91035279,35.38421649,23582,9611,Goldsboro Fire Department,5,3521 Central Heights Rd,Goldsboro,NC,Wayne,27534,35.38,-77.91
-79.33261265,35.58974564,23583,1903,Goldston Rural Fire Department,1,468 South Church St,Goldston,NC,Chatham,27252,35.59,-79.33
-76.57979697,35.30356775,23584,6908,"Goose Creek Island Volunteer Fire Department, Inc.",1,5906 Lowland Rd,Lowland,NC,Pamlico,28552,35.30,-76.58
-81.25473178,36.11685797,23585,9706,"Goshen Volunteer Fire Department, Inc.",1,5450 W. NC 268 Hwy.,Wilkesboro,NC,Wilkes,28697,36.12,-81.25
