X,Y,OBJECTID,FD_ID,DEPT_NAME,STATION_NUMBER,STATION_ADDRESS,CITY,STATE,COUNTY,ZIP_CODE,LATITUDE,LONGITUDE
-76.91880618,35.1329142,24349,6905,"Reelsboro Volunteer Fire-Rescue, Inc.",1,105 Holland Rd,New Bern,NC,Pamlico,28560,35.13,-76.92
-82.50929195,35.69440892,24350,1113,"Reems Creek Valley Fire Department, Incorporated",1,730 Reems Creek Road,Weaverville,NC,Buncombe,28787,35.69,-82.51
-82.53156523,35.64187194,24351,1113,"Reems Creek Valley Fire Department, Incorporated",2,450 Beaverdam Road,Asheville,NC,Buncombe,28804,35.64,-82.53
-79.66467429,36.35727472,24352,7907,Reidsville Fire Department,1,402 S Scales St,Reidsville,NC,Rockingham,27320,36.36,-79.66
-79.65308198,36.33515186,24353,7907,Reidsville Fire Department,2,1826 Barnes St,Reidsville,NC,Rockingham,27320,36.34,-79.65
-79.69653219,36.33669258,24354,7907,Reidsville Fire Department,3,2800 Reid School Rd,Reidsville,NC,Rockingham,27320,36.34,-79.70
-79.07817125,34.81813083,24355,7835,Rennert Volunteer Fire Department,1,9896 Rennert Rd,Shannon,NC,Robeson,28386,34.82,-79.08
-82.47663445,35.55165544,24356,1114,"Reynolds Volunteer Fire Department, Incorporated",1,1 Charles A. Lytle Road,Asheville,NC,Buncombe,28803,35.55,-82.48
-77.70361918,36.40932806,24357,4207,"Rheasville Volunteer Fire Department, Inc.",1,3456 Highway 48,Roanoke Rapids,NC,Halifax,27870,36.41,-77.70
-77.78648542,36.38585317,24358,4207,"Rheasville Volunteer Fire Department, Inc.",2,8473 Highway 48,Roanoke Rapids,NC,Halifax,27870,36.39,-77.79
-77.1807751,35.07155269,24359,2516,"Rhems Volunteer Fire Department, Inc.",1,5860 Hwy 17 South,New Bern,NC,Craven,28562,35.07,-77.18
-77.15158775,35.07609658,24360,2516,"Rhems Volunteer Fire Department, Inc.",2,25 Shoreline Dr,New Bern,NC,Craven,28562,35.08,-77.15
-77.5228,34.827,24361,6713,"Rhodestown Volunteer Fire Department, Inc.",1,116 Rhodestown Fire Dept Rd,Jacksonville,NC,Onslow,28540,34.83,-77.52
-81.4321,35.767,24362,1414,Rhodhiss Fire Department,1,200 Burke Street,Hickory,NC,Caldwell,28601,35.77,-81.43
-82.47212029,35.63076815,24363,1115,"Riceville Volunteer Fire Department, Incorporated",1,2251 Riceville Road,Asheville,NC,Buncombe,28805,35.63,-82.47
-77.28767755,36.27358037,24364,6604,"Rich Square Fire and Rescue, Inc.",1,197 Maple St,Rich Square,NC,Northampton,27869,36.27,-77.29
-80.26444595,35.47044466,24365,8414,"Richfield-Misenheimer Fire Department, Incorporated",1,228 W. Church Street,Richfield,NC,Stanly,28137,35.47,-80.26
-77.54620729,34.9008088,24366,6714,"Richlands Volunteer Fire Department, Inc.",1,113 North Wilmington St.,Richlands,NC,Onslow,28574,34.90,-77.55
-80.36255668,35.31940505,24367,8415,"Ridgecrest Volunteer Fire Department, Inc.",1,24792 Millingport Road,Locust,NC,Stanly,28097,35.32,-80.36
-78.23597166,36.43674242,24368,9312,"Ridgeway Volunteer Rural Fire Association, Inc.",1,668 US Highway 1 South,Norlina,NC,Warren,27563,36.44,-78.24
-80.48171569,35.4761699,24369,1317,Rimer Volunteer Fire Department and Medical Responders,1,4306 Rimer RD.,Concord,NC,Cabarrus,28025,35.48,-80.48
-75.6772,35.9161,24370,2807,"Roanoke Island Volunteer Fire Department, Inc.",1,917 N. Virginia Dare Road,Manteo,NC,Dare,27954,35.92,-75.68
-75.6406,35.8429,24371,2807,"Roanoke Island Volunteer Fire Department, Inc.",2,323 Old Schoolhouse Rd.,Wanchese,NC,Dare,27981,35.84,-75.64
-77.65475283,36.461949,24372,4208,Roanoke Rapids Fire Department,1,643 Roanoke Ave.,Roanoke Rapids,NC,Halifax,27870,36.46,-77.65
-77.64660152,36.42468418,24373,4208,Roanoke Rapids Fire Department,2,638 Hwy 125,Roanoke Rapids,NC,Halifax,27870,36.42,-77.65
-77.90629079,36.53072327,24374,9314,"Roanoke-Wildwood Volunteer Fire Department, Incorporated",1,790 Lizard Creek Road,Littleton,NC,Warren,27850,36.53,-77.91
-77.85048047,36.52235689,24375,9314,"Roanoke-Wildwood Volunteer Fire Department, Incorporated",2,1948 River Road,Henrico,NC,Warren,27842,36.52,-77.85
-81.0208,36.2071,24376,9714,"Roaring River Volunteer Fire Department, Inc.",1,214 Abtco Road,Roaring River,NC,Wilkes,28669,36.21,-81.02
-81.01909808,36.15230396,24377,9714,"Roaring River Volunteer Fire Department, Inc.",2,5225 Speedway Road ,North Wilkesboro,NC,Wilkes,28659,36.15,-81.02
-79.5883,35.4344,24378,6311,Robbins Fire Department,1,301 SW Branson Circle,Robbins,NC,Moore,27325,35.43,-79.59
-77.25341073,35.82292196,24379,5906,Robersonville Fire Department,1,119 S. Main Street,Robersonville,NC,Martin,27871,35.82,-77.25
-80.6575,35.2441,24380,6009,"Robinson Volunteer Fire Department and Rescue, Inc.",1,5304 Mecklenburg Shrine Club Rd,Charlotte,NC,Mecklenburg,28229,35.24,-80.66
-78.06635065,35.70139701,24381,9809,"Rock Ridge Fire Department, Inc.",1,6501 Rock Ridge School Rd,Wilson,NC,Wilson,27893,35.70,-78.07
-78.12904262,35.68062922,24382,9809,"Rock Ridge Fire Department, Inc.",2,8527 NC 42 West,Kenly,NC,Wilson,27542,35.68,-78.13
-79.065843,34.991722,24383,4702,"Rockfish Fire Department, Inc.",1,7600 Philippi Church Rd,Raeford,NC,Hoke,28376,34.99,-79.07
-79.77185324,34.93685832,24384,7707,Rockingham Fire Department,1,231 S. Lawrence St,Rockingham,NC,Richmond,28379,34.94,-79.77
-79.74003515,34.96400939,24385,7707,Rockingham Fire Department,2,830 Roberdel Road,Rockingham,NC,Richmond,28379,34.96,-79.74
-80.41025527,35.55215199,24386,8070,Rockwell City Fire Department,1,116 South Cherry Street,Rockwell,NC,Rowan,28138,35.55,-80.41
-80.41788542,35.55340729,24387,8071,"Rockwell Rural Fire Department, Incorporated",1,320 Link St.,Rockwell,NC,Rowan,28138,35.55,-80.42
-80.418,35.52057,24388,8071,"Rockwell Rural Fire Department, Incorporated",2,11800 Beatty Ford Road,Rockwell,NC,Rowan,28138,35.52,-80.42
-77.79095942,35.938379,24389,3306,Rocky Mount Fire Department,1,375 Raleigh Boulevard,Rocky Mount,NC,Edgecombe,27801,35.94,-77.79
-77.80497662,35.93589586,24390,3306,Rocky Mount Fire Department,2,824 S Grace St,Rocky Mount,NC,Edgecombe,27802,35.94,-77.80
-77.84835242,35.95246252,24391,3306,Rocky Mount Fire Department,3,900 S Winstead Ave,Rocky Mount,NC,Edgecombe,27802,35.95,-77.85
-77.78707469,36.00452604,24392,3306,Rocky Mount Fire Department,4,2054 Fenner Rd,Rocky Mount,NC,Edgecombe,27802,36.00,-77.79
-77.75396781,35.94685989,24393,3306,Rocky Mount Fire Department,5,900 Springfield Rd,Rocky Mount,NC,Edgecombe,27802,35.95,-77.75
-77.8152421,35.96576582,24394,3306,Rocky Mount Fire Department,6,105 Rowe Dr,Rocky Mount,NC,Edgecombe,27802,35.97,-77.82
-77.77076974,36.04798747,24395,3306,Rocky Mount Fire Department,7,9914 NC Hwy 4,Rocky Mount,NC,Edgecombe,27802,36.05,-77.77
-77.88235557,34.4431929,24396,7107,"Rocky Point Volunteer Fire Department, Inc.",1,1425 Porters Lane Rd,Rocky Point,NC,Pender,28457,34.44,-77.88
-77.89420224,34.3875452,24397,7107,"Rocky Point Volunteer Fire Department, Inc.",2,11925 US Hwy 117 South,Rocky Point,NC,Pender,28457,34.39,-77.89
-78.45722146,35.92245673,24398,9214,"Rolesville Rural Fire Department, Inc.",1,104 East Young St.,Rolesville,NC,Wake,27571,35.92,-78.46
-80.94131802,36.21863941,24399,9715,"Ronda Community Volunteer Fire Department, Inc.",1,12164 Elkin Hwy 268,Ronda,NC,Wilkes,28670,36.22,-80.94
-80.92980041,36.17521894,24400,9715,"Ronda Community Volunteer Fire Department, Inc.",2,3463 Clingman Road,Ronda,NC,Wilkes,28670,36.18,-80.93
-76.62226589,35.8749609,24401,9405,"Roper Fire Department, Inc.",1,7121 NC Highway 32 North ,Roper,NC,Washington,27970,35.87,-76.62
-78.02857778,34.82453486,24402,3113,Rose Hill Fire & Rescue Dept.,1,108 East Main St.,Rose Hill,NC,Duplin,28458,34.82,-78.03
-78.507436,34.952705,24403,8209,Roseboro Fire Department,1,301 E. Pleasant St.,Roseboro,NC,Sampson,28382,34.95,-78.51
-78.8392,34.233,24404,2418,"Roseland Volunteer Fire Department, Inc.",1,9527 Claredon Chadbourn Rd,Chadbourn,NC,Columbus,28431,34.23,-78.84
-78.0747,35.4145,24405,9609,"Rosewood Volunteer Fire Department, Inc.",1,884 Rosewood Rd.,Goldsboro,NC,Wayne,27530,35.41,-78.07
-82.82285754,35.1449719,24406,8806,"Rosman Fire/Rescue, Inc.",1,624 Pickens Hwy,Rosman,NC,Transylvania,28772,35.14,-82.82
-80.70940111,35.81110446,24407,8072,"Rowan-Iredell Voluntary Fire Department, Incorporated",1,5757 Chenault Rd,Cleveland,NC,Rowan,27013,35.81,-80.71
-79.29001498,34.53987869,24408,7819,"Rowland Rural Fire Department, Inc.",1,401 N Bond St. ,Rowland,NC,Robeson,28383,34.54,-79.29
-79.29399271,34.53809722,24409,7819,"Rowland Rural Fire Department, Inc.",2,204 W Main St.,Rowland,NC,Robeson,28383,34.54,-79.29
-78.98522105,36.39421,24410,7302,Roxboro Fire Department,1,105 Court Street,Roxboro,NC,Person,27573,36.39,-78.99
-78.9831249,36.37635051,24411,7302,Roxboro Fire Department,2,1035 Durham Road,Roxboro,NC,Person,27573,36.38,-78.98
-78.96775726,36.42579536,24412,7302,Roxboro Fire Department,3,1607 North Main Street,Roxboro,NC,Person,27573,36.43,-78.97
-77.2444,36.2016,24413,809,"Roxobel Volunteer Fire Department, Inc.",1,204 S Main St,Roxobel,NC,Bertie,27872,36.20,-77.24
-79.54528431,36.44704715,24414,7908,"Ruffin Volunteer Fire Department, Inc",1,9562 US 29 Business,Ruffin,NC,Rockingham,27326,36.45,-79.55
-80.29169924,36.24110205,24415,3414,Rural Hall Fire And Rescue,1,177 Hwy 65 East,Rural Hall,NC,Forsyth,27045,36.24,-80.29
-81.96047895,35.36856124,24416,8109,Rutherfordton Fire Department,1,144 N. Mitchell Street,Rutherfordton,NC,Rutherford,28139,35.37,-81.96
-79.0048,34.71266,24417,7820,"Saddletree Volunteer Fire Department, Inc.",1,76 Rozeir Church Rd.,Lumberton,NC,Robeson,28360,34.71,-79.00
-81.69991417,35.69577467,24418,1274,"Salem Community Fire and Rescue Protection Association, Inc",1,1315 Salem Rd,Morganton,NC,Burke,28655,35.70,-81.70
-81.632312,35.70403792,24419,1274,"Salem Community Fire and Rescue Protection Association, Inc",2,3461 NC 18 South,Morganton,NC,Burke,28655,35.70,-81.63
-77.86227166,36.113674,24420,6409,"Salem District Volunteer Fire Department, Inc.",1,4559 Swift Creek School Road,Whitakers,NC,Nash,27891,36.11,-77.86
-78.5017,35.0219,24421,8210,"Salemburg Volunteer Fire Dept., Inc.",1,804 N. Main St,Salemburg,NC,Sampson,28385,35.02,-78.50
-80.4649,35.6635,24422,8050,Salisbury Fire Department,1,514 East Innes Street,Salisbury,NC,Rowan,28144,35.66,-80.46
-80.50252875,35.64909128,24423,8050,Salisbury Fire Department,2,2312 S. Main St.,Salisbury,NC,Rowan,28144,35.65,-80.50
-80.48225324,35.68376057,24424,8050,Salisbury Fire Department,3,1604 W. Innes St.,Salisbury,NC,Rowan,28144,35.68,-80.48
-80.52549154,35.69618217,24425,8050,Salisbury Fire Department,4,2325 Statesville Blvd.,Salisbury,NC,Rowan,28144,35.70,-80.53
-80.529819,35.628156,24426,8050,Salisbury Fire Department,5,310 Cedar Springs Road,Salisbury,NC,Rowan,28147,35.63,-80.53
-82.3505,35.2331,24427,7504,"Saluda Volunteer Fire & Rescue, Inc.",1,199 Walnut Street,Saluda,NC,Polk,28773,35.23,-82.35
-77.46845557,35.29839423,24428,5425,"Sand Hill Volunteer Fire Department, Inc.",1,3216 British Rd,Kinston,NC,Lenoir,28501,35.30,-77.47
-77.70693202,35.20491012,24429,5423,Sandy Bottom Volunteer Fire and Rescue Inc.,1,4640 Highway 55 West ,Kinston,NC,Lenoir,28504,35.20,-77.71
-77.7003,35.2051,24430,5423,Sandy Bottom Volunteer Fire and Rescue Inc.,2,2178 Green Haynes Rd,Kinston,NC,Lenoir,28503,35.21,-77.70
-81.84573866,35.29350141,24431,8110,"Sandy Mush Volunteer Fire Department, Inc.",1,557 US  Hwy 221 A,Forest City,NC,Rutherford,28043,35.29,-81.85
-81.84405033,35.26874243,24432,8110,"Sandy Mush Volunteer Fire Department, Inc.",2,841 Chase Hwy,Forest City,NC,Rutherford,28043,35.27,-81.84
-80.58529464,34.87463105,24433,9012,"Sandy Ridge Fire and Rescue Department, Inc.",1,5010 Plyler Mill Road,Monroe,NC,Union,28112,34.87,-80.59
-79.17932682,35.4878646,24434,5304,Sanford Fire Department,1,512 Hawkins Ave,Sanford,NC,Lee,27330,35.49,-79.18
-79.15687854,35.45663396,24435,5304,Sanford Fire Department,2,2220 Woodland Ave,Sanford,NC,Lee,27330,35.46,-79.16
-79.21963603,35.48134274,24436,5304,Sanford Fire Department,3,900 Cool Springs Rd,Sanford,NC,Lee,27330,35.48,-79.22
-77.77169312,35.66015487,24437,9804,"Sanoca Rural Fire District, Inc.",1,7221 Church St.,Saratoga,NC,Wilson,27873,35.66,-77.77
-77.85763603,34.9790033,24438,3114,Sarecta Fire Department,1,1142 Sarectra Rd,Kenansville,NC,Duplin,28349,34.98,-77.86
-77.8958,35.4389,24439,9626,"Saulston Volunteer Fire Department, Inc.",1,511 Saulston Rd,Goldsboro,NC,Wayne,27534,35.44,-77.90
-83.05602875,35.4521,24440,4410,"Saunook Volunteer Fire Department, Inc.",1,2908 Old Balsam Road,Waynesville,NC,Haywood,28786,35.45,-83.06
-83.26473907,35.29533135,24441,5005,Savannah Volunteer Fire Department,1,18 Ralph Tatham Road,Sylva,NC,Jackson,28779,35.30,-83.26
-83.2816,35.2525,24442,5005,Savannah Volunteer Fire Department,2,18 Sassafras Road,Sylva,NC,Jackson,28779,35.25,-83.28
-83.263,35.32945,24443,5005,Savannah Volunteer Fire Department,3,138 Greens Creek Rd,Sylva,NC,Jackson,28779,35.33,-83.26
-81.47428542,35.82496172,24444,1411,"Sawmills Volunteer Fire & Rescue, Inc.",1,4068 US 321-A ,Granite Falls,NC,Caldwell,28630,35.82,-81.47
-80.62923907,35.81123051,24445,8073,"Scotch-Irish Fire Department, Incorporated",1,3220 Needmore Rd,Woodleaf,NC,Rowan,27054,35.81,-80.63
-77.421,36.12997,24446,4209,Scotland Neck Fire Department,1,103 East 11th St,Scotland Neck,NC,Halifax,27874,36.13,-77.42
-76.49,35.4646,24447,4804,"Scranton Volunteer Fire Department, Inc.",1,5224 Sladesville-Credle RD,Scranton,NC,Hyde,27875,35.46,-76.49
-76.3904,34.8771,24448,1653,"Sea Level Fire Department, Rescue Squad and Community Center, Inc.",1,647 HWY 70,Sea Level,NC,Carteret,28577,34.88,-76.39
-77.44271842,36.49042777,24449,6605,"Seaboard Volunteer Fire Department, Inc.",1,108 West Central Street,Seaboard,NC,Northampton,27876,36.49,-77.44
-79.77449656,35.5411,24450,7612,"Seagrove Rural Volunteer Fire Department, Inc.",1,281 East Main Street,Seagrove,NC,Randolph,27341,35.54,-79.77
-78.2817,35.5365,24451,5120,Selma Fire Department,1,201 N Webb St.,Selma,NC,Johnston,27576,35.54,-78.28
-79.14958542,36.4987929,24452,1706,"Semora Volunteer Fire Department, Inc.",1,4997 Hwy 57 North,Semora,NC,Caswell,27343,36.50,-79.15
-81.7994,36.1559,24453,9511,Seven Devils Fire Department,1,1356 Seven Devils Road,Banner Elk,NC,Watauga,28604,36.16,-81.80
-79.57324291,35.27085256,24454,6363,"Seven Lakes Fire, Rescue, and EMS",1,718 Seven Lakes Drive,West End,NC,Moore,27376,35.27,-79.57
-77.852592,35.2231109,24455,9627,"Seven Springs Community Volunteer Fire Department, Inc.",1,5377 NC 55 Highway East,Seven Springs,NC,Wayne,28578,35.22,-77.85
-77.18207854,36.51666383,24456,6606,"Severn Volunteer Fire Department, Incorporated",1,9215 NC 35 ,Severn,NC,Northampton,27877,36.52,-77.18
-78.38106589,33.9743178,24457,1008,Shallotte Fire Department,1,125 Wall St.,Shallotte,NC,Brunswick,28470,33.97,-78.38
-78.42631953,33.98691779,24458,1008,Shallotte Fire Department,2,920 Whiteville RD,Shallotte,NC,Brunswick,28470,33.99,-78.43
-78.41431761,33.9615389,24459,1008,Shallotte Fire Department,3,40 Naber Dr,Shallotte,NC,Brunswick,28470,33.96,-78.41
-78.378825,33.925399,24460,1016,"Shallotte Point Volunteer Fire Department, Inc.",1,4126 Pigott Rd ,Shallotte,NC,Brunswick,28470,33.93,-78.38
-81.608935,35.240935,24461,2314,"Shanghai Volunteer Fire Department, Inc.",1,1435 Burke Rd.,Shelby,NC,Cleveland,28152,35.24,-81.61
-79.13872834,34.84738554,24462,7821,"Shannon Volunteer Fire Department, Inc.",1,14592 NC Hwy 71 N,Shannon,NC,Robeson,28386,34.85,-79.14
,,24463,7821,"Shannon Volunteer Fire Department, Inc.",2,1905 Colon Mintz Road,Leland,NC,Robeson,28451,,
-77.58318198,35.71744355,24464,7456,"Sharp Point Volunteer Fire Department, Inc.",1,4975 Sharp Point Rd,Fountain,NC,Pitt,27829,35.72,-77.58
-77.82989312,35.86973259,24465,6410,"Sharpsburg Fire Prevention Association, Inc.",1,300 Taylor Dr.,Sharpsburg,NC,Nash,27878,35.87,-77.83
-77.82699464,35.86862911,24466,6410,"Sharpsburg Fire Prevention Association, Inc.",2,100 Southeast Railroad Street,Sharpsburg,NC,Nash,27878,35.87,-77.83
-81.81073143,36.19250607,24467,9512,Shawneehaw Volunteer Fire Department,1,171 Rominger Road,Banner Elk,NC,Watauga,28604,36.19,-81.81
-80.67855708,35.97076541,24468,3016,"Sheffield-Calahaln Volunteer Fire Department, Inc.",1,435 Dyson Road,Mocksville,NC,Davie,27028,35.97,-80.68
-81.53055749,35.30247096,24469,2315,Shelby Fire Department,1,506 E. Grover St.,Shelby,NC,Cleveland,28150,35.30,-81.53
-81.56100729,35.28779633,24470,2315,Shelby Fire Department,2,303 Charles Rd.,Shelby,NC,Cleveland,28150,35.29,-81.56
-81.4883,35.2761,24471,2315,Shelby Fire Department,3,2425 Kings Rd.,Shelby,NC,Cleveland,28150,35.28,-81.49
-81.00957621,36.27189895,24472,9725,"Shepherds Cross-Roads Volunteer Fire Department, Inc.",1,6188 White Plains Road,Roaring River,NC,Wilkes,28669,36.27,-81.01
-80.82653143,35.62291002,24473,4907,"Shepherds Fire-Rescue, Inc.",1,2014 Charlotte Hwy,Mooresville,NC,Iredell,28117,35.62,-80.83
-80.8991502,35.5960349,24474,4907,"Shepherds Fire-Rescue, Inc.",2,204 Doolie Road,Mooresville,NC,Iredell,28117,35.60,-80.90
-80.99104291,35.58407314,24475,1815,"Sherrills Ford - Terrell Fire & Rescue, INC.",1,4011 Slanting Bridge Rd,Sherrills Ford,NC,Catawba,28673,35.58,-80.99
-81.03582875,35.57403491,24476,1815,"Sherrills Ford - Terrell Fire & Rescue, INC.",2,4385 Mt. Pleasant Rd,Sherrills Ford,NC,Catawba,28673,35.57,-81.04
-81.0158084,35.56719745,24477,1815,"Sherrills Ford - Terrell Fire & Rescue, INC.",3,4582 Burris Rd,Denver,NC,Catawba,28037,35.57,-81.02
-80.983815,35.636349,24478,1815,"Sherrills Ford - Terrell Fire & Rescue, INC.",4,2080 Mollys Backbone Road,Sherrills Ford,NC,Catawba,28673,35.64,-80.98
-79.86545749,36.44942371,24479,7909,"Shiloh Community Fire Protection Association, Inc.",1,3320 Settle Bridge Rd.,Stoneville,NC,Rockingham,27048,36.45,-79.87
-78.10366589,34.59341354,24480,7108,"Shiloh-Columbia Volunteer Fire Department, Inc.",1,19170 US Hwy 421,Watha,NC,Pender,28478,34.59,-78.10
-81.9056923,35.28834746,24481,8103,"Shiloh-Danieltown-Oakland Volunteer Fire Department, Inc.",1,115 Toms Lake Road,Forest City,NC,Rutherford,28043,35.29,-81.91
-81.9289,35.21027924,24482,8103,"Shiloh-Danieltown-Oakland Volunteer Fire Department, Inc.",2,1061 W.V. Thompson Road,Rutherfordton,NC,Rutherford,28139,35.21,-81.93
-77.79142414,35.4415973,24483,4009,"Shine Rural Volunteer Fire and EMS Association, Inc.",1,84 Shine Rd,Snow Hill,NC,Greene,28580,35.44,-77.79
-82.0717,35.4739,24484,8113,"Shingle Hollow Volunteer Fire Department, Inc.",1,2621 Cove Rd,Rutherfordton,NC,Rutherford,28139,35.47,-82.07
-80.49987895,36.30272651,24485,8661,"Shoals Volunteer Fire District, Inc.",1,2964 Shoals Road,Pinnacle,NC,Surry,27043,36.30,-80.50
-76.66011461,35.47380777,24486,716,Sidney Volunteer Fire Department Inc.,1,6755 N. Savannah RD,Belhaven,NC,Beaufort,27810,35.47,-76.66
-79.46468475,35.7252,24487,1907,Siler City Fire Department,1,310 North Chatam Ave,Siler City,NC,Chatham,27344,35.73,-79.46
-79.36949079,35.781,24488,1908,"Silk Hope Volunteer Fire Department, Inc.",1,8110 Silk Hope - Gum Springs Rd.,Siler City,NC,Chatham,27344,35.78,-79.37
-79.4495,35.8142,24489,1908,"Silk Hope Volunteer Fire Department, Inc.",2,5226 Silk Hope - Liberty Rd.,Siler City,NC,Chatham,27344,35.81,-79.45
-77.95159398,35.79569262,24490,9807,"Silver Lake Volunteer Fire Department, Inc.",1,5215 Hornes Church Rd,Wilson,NC,Wilson,27896,35.80,-77.95
-80.09946245,35.72548225,24491,2913,"Silver Valley Fire Department, Inc.",1,11450 S. NC 109,Lexington,NC,Davidson,27292,35.73,-80.10
-80.14820344,35.71569582,24492,2913,"Silver Valley Fire Department, Inc.",2,1685 Regan Road,Lexington,NC,Davidson,27292,35.72,-80.15
-77.27556128,35.57450436,24493,7432,"Simpson Rural Fire Dept., Inc.",1,2821 Virginia St,Simpson,NC,Pitt,27879,35.57,-77.28
-78.05319656,35.75885224,24494,9814,Sims Community Rural Fire Department,1,6217 US Highway 264 Alternate West,Sims,NC,Wilson,27880,35.76,-78.05
-80.82118583,36.4994,24495,8672,"Skull Camp Volunteer Fire Department, Incorporated",1,7211 West Pine Street,Lowgap,NC,Surry,27024,36.50,-80.82
-80.8695,36.52948621,24496,8672,"Skull Camp Volunteer Fire Department, Incorporated",2,9088 West Pine Street,Lowgap,NC,Surry,27024,36.53,-80.87
-80.7996,36.462991,24497,8672,"Skull Camp Volunteer Fire Department, Incorporated",3,913 Woltz Atkins Road,Mount Airy,NC,Surry,27030,36.46,-80.80
-83.30541962,35.0194006,24498,5709,Sky Valley - Scaly Mountain Volunteer Fire and Rescue Department Incorporated,1,169 Hale Ridge Road,Scaly Mountain,NC,Macon,28775,35.02,-83.31
-82.52398781,35.48447395,24499,1116,Skyland Fire and Rescue Corporation,1,9 Miller Road South,Asheville,NC,Buncombe,28803,35.48,-82.52
-82.5739,35.4638,24500,1116,Skyland Fire and Rescue Corporation,2,899 Glen Bridge SE,Arden,NC,Buncombe,28704,35.46,-82.57
-82.4792379,35.48721966,24501,1116,Skyland Fire and Rescue Corporation,3,310 Williams Road,Fletcher,NC,Buncombe,28732,35.49,-82.48
-82.53042232,35.51573852,24502,1116,Skyland Fire and Rescue Corporation,4,7 Valley Springs Road,Asheville,NC,Buncombe,28803,35.52,-82.53
-78.1549,35.2067,24503,9628,"Smith Chapel Volunteer Fire Department, Inc.",1,2843 Grantham School Rd,Mount Olive,NC,Wayne,28365,35.21,-78.15
-80.48273067,35.98467813,24504,3024,"Smith Grove Volunteer Fire Department, Inc.",1,4155 U.S. Hwy. 158 ,Advance,NC,Davie,27006,35.98,-80.48
-78.34474595,35.50958253,24505,5121,Smithfield Fire Department,1,111 S Fourth St,Smithfield,NC,Johnston,27577,35.51,-78.34
-78.3619,35.52632,24506,5121,Smithfield Fire Department,2,1200 West Market St,Smithfield,NC,Johnston,27577,35.53,-78.36
-79.29097277,34.81034585,24507,7822,Smiths Volunteer Fire Department,1,2906 Oxendine School Rd,Maxton,NC,Robeson,28364,34.81,-79.29
,,24508,7822,Smiths Volunteer Fire Department,2,3255 Maco Road,Leland,NC,Robeson,28451,,
-79.02963026,34.54157906,24509,7823,Smyrna Township Volunteer Fire Department,1,2910 Wiregrass Rd,Lumberton,NC,Robeson,28358,34.54,-79.03
-79.4279,35.8833,24510,111,"Snow Camp Volunteer Fire Department, Inc.",1,8408 Snow Camp,Snow Camp,NC,Alamance,27349,35.88,-79.43
-79.49609271,35.91224794,24511,111,"Snow Camp Volunteer Fire Department, Inc.",2,2545 W. Greensboro-Chapel Hill Road,Snow Camp,NC,Alamance,27349,35.91,-79.50
-79.50584636,35.85712174,24512,111,"Snow Camp Volunteer Fire Department, Inc.",3,2404 Staley Store Road,Liberty,NC,Alamance,27298,35.86,-79.51
-79.43315172,35.92398262,24513,111,"Snow Camp Volunteer Fire Department, Inc.",4,6457 Bass Mountain Road,Snow Camp,NC,Alamance,27349,35.92,-79.43
-77.65684879,35.44135796,24514,4004,"Snow Hill Rural Fire Department, Incorporated",1,201 Carolina Dr.,Snow Hill,NC,Greene,28580,35.44,-77.66
-79.8761,35.8401,24515,7616,Sophia Fire Department Inc.,1,6740 US Hwy 311,Sophia,NC,Randolph,27350,35.84,-79.88
-78.26609656,36.41544317,24516,9309,"Soul City Volunteer Rural Fire Association, Inc.",1,103 Cresent Drive,Manson,NC,Warren,27553,36.42,-78.27
-79.205482,34.88015,24517,4708,"South Antioch Volunteer Fire Department, Inc.",1,6931 Red Springs Rd,Red Springs,NC,Hoke,28377,34.88,-79.21
-76.1797,36.3349,24518,1501,"South Camden Fire Department, Inc.",1,114 Sawyer's Creek Rd,Camden,NC,Camden,27921,36.33,-76.18
-76.06377171,36.27323006,24519,1501,"South Camden Fire Department, Inc.",2,1061 South NC Hwy 343,Shiloh,NC,Camden,27974,36.27,-76.06
-80.09787854,35.5706691,24520,2924,"South Davidson Fire Department, Inc.",1,22320 NC 109,Denton,NC,Davidson,27239,35.57,-80.10
-77.5855,35.81648,24521,3314,South Edgecombe Rural Fire Department,1,6697 US 258 South,Pinetops,NC,Edgecombe,27864,35.82,-77.59
-77.63884408,35.79042611,24522,3314,South Edgecombe Rural Fire Department,2,102 West Burnette St.,Pinetops,NC,Edgecombe,27864,35.79,-77.64
-80.77456741,35.56776182,24523,4908,"South Iredell Volunteer Fire Department, Inc.",1,651 Brumley Rd,Mooresville,NC,Iredell,28115,35.57,-80.77
-80.2362,35.7467,24524,2914,"South Lexington Volunteer Fire Department, Inc.",1,1877 NC Highway 47,Lexington,NC,Davidson,27292,35.75,-80.24
-80.2589,35.7703,24525,2914,"South Lexington Volunteer Fire Department, Inc.",2,2000 Cotton Grove Road,Lexington,NC,Davidson,27292,35.77,-80.26
-76.333516,36.47149,24526,1502,"South Mills Volunteer Fire Department, Inc.",1,127 Keeter Barn Rd,South Mills,NC,Camden,27976,36.47,-76.33
-76.331419,36.445476,24527,1502,"South Mills Volunteer Fire Department, Inc.",2,105 Halstead Street,South Mills,NC,Camden,27976,36.45,-76.33
-81.56297166,35.58297784,24528,1279,"South Mountains Fire Rescue, Inc.",1,8204 Gus Peeler Road,Connelly Springs,NC,Burke,28612,35.58,-81.56
-76.59992,34.96017,24529,1623,"South River-Merrimon Fire & Ems, Inc.",1,1329 South River Rd,Beaufort,NC,Carteret,28516,34.96,-76.60
-80.48956781,35.61915699,24530,8074,"South Salisbury Township Fire Department, Incorporated",1,3207 Old Concord Road ,Salisbury,NC,Rowan,28146,35.62,-80.49
-80.1958,35.3096,24531,8417,"South Side Volunteer Fire Department, Incorporated",1,20790 Hwy 138,Albemarle,NC,Stanly,28001,35.31,-80.20
-80.17746437,35.32039502,24532,8417,"South Side Volunteer Fire Department, Incorporated",2,37348 Southside Road,Albemarle,NC,Stanly,28001,35.32,-80.18
-80.22089574,36.34981359,24533,8508,South Stokes Volunteer Fire Department,1,4747 Flat Shoals,Walnut Cove,NC,Stokes,27052,36.35,-80.22
-80.22697166,36.28572704,24534,8508,South Stokes Volunteer Fire Department,2,6624 NC Hwy 8 South,Germanton,NC,Stokes,27019,36.29,-80.23
-80.6731,36.3102,24535,8674,"South Surry Volunteer Fire Dept., Inc.",1,3124 Rockford Road,Dobson,NC,Surry,27017,36.31,-80.67
-80.6286,36.3454,24536,8674,"South Surry Volunteer Fire Dept., Inc.",2,4056 Siloam Road,Dobson,NC,Surry,27017,36.35,-80.63
-80.719,36.32252,24537,8674,"South Surry Volunteer Fire Dept., Inc.",3,8455 US 601,Dobson,NC,Surry,27017,36.32,-80.72
-82.189754,35.841126,24538,10013,"South Toe Volunteer Fire and Rescue, Incorporated",1,5455 State Hwy. 80 South,Burnsville,NC,Yancey,28714,35.84,-82.19
