X,Y,OBJECTID,FD_ID,DEPT_NAME,STATION_NUMBER,STATION_ADDRESS,CITY,STATE,COUNTY,ZIP_CODE,LATITUDE,LONGITUDE
-78.5794,35.5123,22816,5112,"50 - 210 Community Fire Department, Inc.",1,50 Greenfield Rd,Angier,NC,Johnston,27501,35.51,-78.58
-78.6366,35.5602,22817,5112,"50 - 210 Community Fire Department, Inc.",2,3715 Jackson King Rd,Willow Spring,NC,Johnston,27592,35.56,-78.64
-78.5937,35.5603,22818,5112,"50 - 210 Community Fire Department, Inc.",3,13954 NC Hwy 50 N,Angier,NC,Johnston,27501,35.56,-78.59
-79.42266397,35.14172714,22819,6341,Aberdeen Fire Department,1,800 Holly St.,Aberdeen,NC,Moore,28315,35.14,-79.42
-79.3875,35.11609,22820,6341,Aberdeen Fire Department,2,10861 NC 211 Hwy Est,Aberdeen,NC,Moore,28315,35.12,-79.39
-78.224562,34.340834,22821,2401,"Acme-Delco-Riegelwood Fire-Rescue, Inc.",1,100 John Riegel Road,Riegelwood,NC,Columbus,28456,34.34,-78.22
-78.2783,34.2687,22822,2401,"Acme-Delco-Riegelwood Fire-Rescue, Inc.",2,4328 Livingston Chapel Road,Delco,NC,Columbus,28436,34.27,-78.28
-78.29174,34.3776,22823,2401,"Acme-Delco-Riegelwood Fire-Rescue, Inc.",3,1795 Woodyard Rd,Riegelwood,NC,Columbus,28456,34.38,-78.29
-80.4127,35.9455,22824,3012,"Advance Fire Department, Inc.",1,1869 S. NC 801 Hwy.,Advance,NC,Davie,27006,35.95,-80.41
-80.4097,35.9453,22825,3012,"Advance Fire Department, Inc.",2,169 Fire Station Rd. (satelite station),Advance,NC,Davie,27006,35.95,-80.41
-78.2195,36.3135,22826,9301,"Afton-Elberon Volunteer Fire Department, Inc.",1,2350 US Highway 401 South,Warrenton,NC,Warren,27589,36.31,-78.22
-81.232,35.3285,22827,3601,Agriculture Center Volunteer Fire Department Inc.,1,1428 Costner School Road,Bessemer City,NC,Gaston,28016,35.33,-81.23
-76.98391922,36.28166884,22828,4601,Ahoskie Fire Department,1,301 S. Martin Luther King Jr. Boulevard,Ahoskie,NC,Hertford,27910,36.28,-76.98
-76.99192682,36.28840487,22829,4610,"Ahoskie Rural Volunteer Fire Department, Inc.",1,609 West Main St.,Ahoskie,NC,Hertford,27910,36.29,-76.99
-79.70762956,36.02020909,22830,4101,"Alamance Community Fire District, Inc.",1,4108 Presbyterian Rd.,Greensboro,NC,Guilford,27407,36.02,-79.71
-79.6889,35.9861,22831,4101,"Alamance Community Fire District, Inc.",2,4831 Blakeshire Rd.,Greensboro,NC,Guilford,27406,35.99,-79.69
-83.4542,35.3586,22832,8704,"Alarka Volunteer Fire Department, Inc.",1,3601 Alarka Road,Bryson City,NC,Swain,28713,35.36,-83.45
-80.17176397,35.35007635,22833,8401,Albemarle Fire Department,1,1610 E. Main Street,Albemarle,NC,Stanly,28002,35.35,-80.17
-80.21616794,35.3548878,22834,8401,Albemarle Fire Department,2,607 Concord Rd,Albemarle,NC,Stanly,28001,35.35,-80.22
-80.19111342,35.38593531,22835,8401,Albemarle Fire Department,3,209 Northeast Connector,Albemarle,NC,Stanly,28001,35.39,-80.19
-77.8199,35.1134,22836,3101,Albertson Volunteer Fire Department,1,732 Sheep Pasture Rd,Albertson,NC,Duplin,28508,35.11,-77.82
-81.1139,35.3972,22837,3602,"Alexis Volunteer Fire Department, Inc.",1,4221 NC 27 Hwy.,Alexis,NC,Gaston,28006,35.40,-81.11
-81.08677085,35.4624728,22838,3602,"Alexis Volunteer Fire Department, Inc.",2,4639 Old Plank Road,Iron Station,NC,Gaston,28080,35.46,-81.09
-80.54182146,35.36143875,22839,1301,"Allen Volunteer Fire Department, Inc.",1,4000 US Hwy 601 South,Concord,NC,Cabarrus,28025,35.36,-80.54
-80.40707662,34.91136481,22840,9001,"Allens Crossroads Volunteer Fire Department, Inc.",1,5408 White Store Road,Wingate,NC,Union,28174,34.91,-80.41
-78.86510647,36.38886514,22841,7307,"Allensville Volunteer Fire Department, Inc.",1,1344 Denny's Store Road,Roxboro,NC,Person,27574,36.39,-78.87
-78.92298198,34.59204985,22842,7801,"Allenton Volunteer Fire Department, Inc.",1,6815 NC 211 East ,Lumberton,NC,Robeson,28358,34.59,-78.92
-78.90266245,34.51571326,22843,7801,"Allenton Volunteer Fire Department, Inc.",2,3937 Willoughby Road,Lumberton,NC,Robeson,28358,34.52,-78.90
-79.5137,36.1793,22844,101,"Altamahaw-Ossippee Fire Department, Inc.",1,2806 Old 87 Hwy,Elon,NC,Alamance,27244,36.18,-79.51
-79.51230192,36.22252969,22845,101,"Altamahaw-Ossippee Fire Department, Inc.",2,4168 Stoney Creek Church Rd,Elon,NC,Alamance,27244,36.22,-79.51
-78.9559,35.25516584,22846,4301,"Anderson Creek Emergency Services, Inc.",1,6400 Overhill Road,Spring Lake,NC,Harnett,28390,35.26,-78.96
-79.34084099,36.26594758,22847,1709,"Anderson Township Volunteer Fire Department, Inc.",1,225 Baynes Road,Burlington,NC,Caswell,27217,36.27,-79.34
-79.35271265,36.31583084,22848,1709,"Anderson Township Volunteer Fire Department, Inc.",2,6774 NC Hwy 62 South,Yanceyville,NC,Caswell,27379,36.32,-79.35
-83.82396822,35.19916411,22849,2001,Andrews Fire Department,1,85 Fourth Street,Andrews,NC,Cherokee,28901,35.20,-83.82
-78.7394,35.5117,22850,4302,"Angier & Black River Fire Department, Inc.",1,309 North Broad St. East,Angier,NC,Harnett,27501,35.51,-78.74
-80.10787166,35.10614201,22851,401,"Ansonville Volunteer Fire Department, Inc.",1,9145 NC 52 Hwy ,Ansonville,NC,Anson,28007,35.11,-80.11
-78.228497,35.679477,22852,5101,"Antioch Fire Department, Incorporated",1,106668 NC Highway 42,Middlesex,NC,Johnston,27557,35.68,-78.23
-78.24584443,35.69510415,22853,5101,"Antioch Fire Department, Incorporated",2,8604 Hwy 39 N,Middlesex,NC,Johnston,27557,35.70,-78.25
-78.55026904,36.28599622,22854,3913,"Antioch-Fishing Creek Volunteer Fire Department, Incorporated",1,5065 Antioch Road,Oxford,NC,Granville,27565,36.29,-78.55
-78.85051073,35.73183453,22855,9205,Apex Fire Department,1,210 N Salem St,Apex,NC,Wake,27502,35.73,-78.85
-78.93154251,35.67336973,22856,9205,Apex Fire Department,2,3045 New Hill Holleman,New Hill,NC,Wake,27562,35.67,-78.93
-78.8607333,35.73575603,22857,9205,Apex Fire Department,3,736 Hunter St.,Apex,NC,Wake,27502,35.74,-78.86
-78.8348,35.70529,22858,9205,Apex Fire Department,4,1615 E. Williams St.,Apex,NC,Wake,27502,35.71,-78.83
-78.88954373,35.7218748,22859,9205,Apex Fire Department,5,2050 Kelly Road,Apex,NC,Wake,27502,35.72,-78.89
-80.226,35.2252,22860,8402,"Aquadale Rural Volunteer Fire Department, Inc.",1,11578 NC 138 Hwy,Norwood,NC,Stanly,28128,35.23,-80.23
-80.18812834,35.19749288,22861,8402,"Aquadale Rural Volunteer Fire Department, Inc.",2,4838 Plank Rd,Norwood,NC,Stanly,28128,35.20,-80.19
-76.82407813,35.02380671,22862,6901,"Arapahoe Volunteer Fire-Rescue, Inc.",1,8233 NC Hwy 306 South,Arapahoe,NC,Pamlico,28510,35.02,-76.82
-80.55894367,36.40277911,22863,8663,"Ararat Volunteer Fire Department, Incorporated",1,1415 Ararat Road,Ararat,NC,Surry,27007,36.40,-80.56
-77.6964,35.4033,22864,4001,"Arba Rural Fire Association, Incorporated",1,2001 Jessie Hill Rd,Snow Hill,NC,Greene,28580,35.40,-77.70
-80.30863603,35.94119577,22865,2901,"Arcadia-Reedy Creek-Hampton Volunteer Fire and Rescue Department, Inc.",1,1374 Ruff Leonard Road,Lexington,NC,Davidson,27295,35.94,-80.31
-77.98176589,36.2901978,22866,9302,"Arcola Rural Volunteer Fire Department, Inc.",1,2169 NC Hwy 43,Warrenton,NC,Warren,27589,36.29,-77.98
-80.83,36.2248,22867,9916,"Arlington Fire and Rescue, Inc.",1,321 South Main Street,Jonesville,NC,Yadkin,28642,36.22,-80.83
-80.8072,36.1971,22868,9916,"Arlington Fire and Rescue, Inc.",2,4510 Little Mountain Road,Jonesville,NC,Yadkin,28642,36.20,-80.81
-77.980924,35.298486,22869,9602,"Arrington Volunteer Fire Department, Inc.",1,570 Emmaus Church Rd.,Dudley,NC,Wayne,28333,35.30,-77.98
-79.81674828,35.70163804,22870,7601,Asheboro Fire Department,1,401 S. Church Street,Asheboro,NC,Randolph,27203,35.70,-79.82
-79.80579615,35.75740883,22871,7601,Asheboro Fire Department,2,2105 N. Fayettville Street,Asheboro,NC,Randolph,27203,35.76,-79.81
-82.5499923,35.59462955,22872,1101,Asheville Fire Department,1,100 Court Plaza,Asheville,NC,Buncombe,28801,35.59,-82.55
-82.56044525,35.57813054,22873,1101,Asheville Fire Department,2,415 South French Broad Avenue,Asheville,NC,Buncombe,28801,35.58,-82.56
-82.59169375,35.58523292,22874,1101,Asheville Fire Department,3,50 Oregon Avenue,Asheville,NC,Buncombe,28806,35.59,-82.59
-82.52450461,35.48438987,22875,1101,Asheville Fire Department,4,9 Miller Road,Asheville,NC,Buncombe,28805,35.48,-82.52
-82.52886286,35.53682263,22876,1101,Asheville Fire Department,5,1074 Hendersonville Road,Asheville,NC,Buncombe,28803,35.54,-82.53
-82.60210729,35.58090804,22877,1101,Asheville Fire Department,6,970 Haywood Road,Asheville,NC,Buncombe,28806,35.58,-82.60
-82.55290163,35.62301172,22878,1101,Asheville Fire Department,7,37 East Larchmont Drive,Asheville,NC,Buncombe,28804,35.62,-82.55
-82.50287318,35.58776679,22879,1101,Asheville Fire Department,8,904 Tunnel Road,Asheville,NC,Buncombe,28805,35.59,-82.50
-82.51352682,35.56427309,22880,1101,Asheville Fire Department,9,749 Fairview Road,Asheville,NC,Buncombe,28803,35.56,-82.51
-82.63385324,35.56473418,22881,1101,Asheville Fire Department,10,1903 Old Haywood Road,Asheville,NC,Buncombe,28806,35.56,-82.63
-82.60485172,35.53411471,22882,1101,Asheville Fire Department,11,7 Rocky Ridge Road,Asheville,NC,Buncombe,28806,35.53,-82.60
-82.50197166,35.61115639,22883,1101,Asheville Fire Department,12,880 New Hawcreek Road,Asheville,NC,Buncombe,28805,35.61,-82.50
-81.95691609,35.86244349,22884,5601,Ashford - North Cove Volunteer Fire Department,1,15640 Hwy. 221 North,Marion,NC,McDowell,28752,35.86,-81.96
-76.9393498,36.10907865,22885,801,"Askewville Volunteer Fire Department, Inc.",1,105 S Railroad St ,Windsor,NC,Bertie,27983,36.11,-76.94
-78.17059464,34.5287812,22886,7101,Atkinson Fire Department,1,110 N First Ave,Atkinson,NC,Pender,28421,34.53,-78.17
-76.73993411,34.70079262,22887,1634,Atlantic Beach Fire Department,1,125 West Fort Macon Rd.,Atlantic Beach,NC,Carteret,28512,34.70,-76.74
-80.68,35.5728,22888,8040,"Atwell Township Fire Department, Incorporated",1,135 Concordia Church Road,Mooresville,NC,Rowan,28115,35.57,-80.68
-80.7199,35.5319,22889,8040,"Atwell Township Fire Department, Incorporated",2,8480 Unity Church Rd.,Kannapolis,NC,Rowan,28081,35.53,-80.72
-77.1153,36.2293,22890,802,Aulander Fire Department,1,124 W. Main St.,Aulander,NC,Bertie,27805,36.23,-77.12
-76.78339423,35.30036498,22891,701,"Aurora Volunteer Fire Department, Inc.",1,99 NC Hwy 33 East,Aurora,NC,Beaufort,27806,35.30,-76.78
-76.88190133,35.32513336,22892,701,"Aurora Volunteer Fire Department, Inc.",2,49 Labor Camp Road,Edward,NC,Beaufort,27821,35.33,-76.88
-80.96110729,36.3137,22893,9701,"Austin Volunteer Fire Department, Inc.",1,7170 Austin-Traphill RD.,Elkin,NC,Wilkes,28621,36.31,-80.96
-80.83008198,36.22489474,22894,9701,"Austin Volunteer Fire Department, Inc.",2,321 South Main Street,Jonesville,NC,Wilkes,28642,36.22,-80.83
-78.6395,34.9999,22895,8201,"Autryville Area Fire Department, Inc.",1,305 North Hotel St. ,Autryville,NC,Sampson,28318,35.00,-78.64
-75.50604676,35.35337875,22896,2801,"Avon Volunteer Fire Department, Inc.",1,40159 Harbor Rd.,Avon,NC,Dare,27915,35.35,-75.51
-77.41659697,35.47236894,22897,7444,Ayden Fire Department,1,4112 West Ave,Ayden,NC,Pitt,28513,35.47,-77.42
-77.36279699,35.47060526,22898,7444,Ayden Fire Department,2,1809 NC 102 East,Ayden,NC,Pitt,28513,35.47,-77.36
-77.4162,35.4725,22899,7442,"Ayden Rural Fire Association, Inc.",1,4112 West Ave,Ayden,NC,Pitt,28513,35.47,-77.42
-77.62335364,34.83764716,22900,6701,"Back Swamp Volunteer Fire Department, Inc.",1,2957 Catherine Lake Rd,Richlands,NC,Onslow,28574,34.84,-77.62
-80.1274,35.4923,22901,6207,"Badin Lake Volunteer Fire Department, Inc.",1,387 Uwharrie Parkway,New London,NC,Montgomery,28127,35.49,-80.13
-80.1071249,35.49837161,22902,6207,"Badin Lake Volunteer Fire Department, Inc.",2,1018 Pinehaven Dr,New London,NC,Montgomery,28127,35.50,-80.11
-80.08166093,35.48703885,22903,6207,"Badin Lake Volunteer Fire Department, Inc.",3,625 Blaine Rd,New London,NC,Montgomery,28127,35.49,-80.08
-80.11802186,35.40399466,22904,8403,"Badin Volunteer Fire Department, Inc.",1,128 NC 740 Hwy,Badin,NC,Stanly,28009,35.40,-80.12
-78.87208006,36.16766694,22905,3201,"Bahama Volunteer Fire, Rescue, Ems Company, Inc.",1,1814 Bahama Road,Bahama,NC,Durham,27503,36.17,-78.87
-78.9164,36.2035,22906,3201,"Bahama Volunteer Fire, Rescue, Ems Company, Inc.",2,11819 North Roxboro Rd,Rougemont,NC,Durham,27572,36.20,-78.92
-78.84919236,36.126787,22907,3201,"Bahama Volunteer Fire, Rescue, Ems Company, Inc.",3,6201 Stagville Rd,Bahama,NC,Durham,27503,36.13,-78.85
-78.11707703,35.77923008,22908,6401,"Bailey Fire Department, Green Hornet Fire District, Inc.",1,6336 Main Street,Bailey,NC,Nash,27807,35.78,-78.12
-78.0429,35.805,22909,6401,"Bailey Fire Department, Green Hornet Fire District, Inc.",2,2509 West Hornes Church Road,Bailey,NC,Nash,27807,35.81,-78.04
-80.6272502,35.03592563,22910,9002,"Bakers Volunteer Fire and Rescue Department, Inc.",1,4425 Old Charlotte Highway,Monroe,NC,Union,28110,35.04,-80.63
-82.1625498,36.01306983,22911,6101,Bakersville Fire And Rescue,1,306 Baker Lane,Bakersville,NC,Mitchell,28705,36.01,-82.16
-82.176782,35.9725,22912,6101,Bakersville Fire And Rescue,2,18 Water Street,Bakersville,NC,Mitchell,28705,35.97,-82.18
-77.7461,35.7215,22913,9813,Bakertown Volunteer Fire and 1st Responder,1,6505 Webb Lake Rd,Elm City,NC,Wilson,27822,35.72,-77.75
-77.982376,33.856653,22914,1019,Bald Head Island Fire Department,1,273 Edward Teach Wynd,Southport,NC,Brunswick,28461,33.86,-77.98
-77.96489823,33.85480473,22915,1019,Bald Head Island Fire Department,2,9 Cape Creek Road,Bald Head Island,NC,Brunswick,28461,33.85,-77.96
-82.8732414,35.22972328,22916,8814,"Balsam Grove Volunteer Fire Rescue, Inc.",1,8720 Parkway Rd,Balsam Grove,NC,Transylvania,28708,35.23,-82.87
-83.11555405,35.41156009,22917,5006,"Balsam-Willets-Ochre Hill Volunteer Fire Department, Incorporated",1,36 Mount Pleasant Church Road,Sylva,NC,Jackson,28779,35.41,-83.12
-83.10447166,35.42729617,22918,5006,"Balsam-Willets-Ochre Hill Volunteer Fire Department, Incorporated",2,43 Woodfin Road,Sylva,NC,Jackson,28779,35.43,-83.10
-81.0913,35.64118719,22919,1801,"Bandys Crossroads Volunteer Fire Department, Incorporated",1,1611 Buffalo Shoals Road,Catawba,NC,Catawba,28609,35.64,-81.09
-81.1289,35.5835,22920,1801,"Bandys Crossroads Volunteer Fire Department, Incorporated",2,3679 Buffalo Shoals Road,Maiden,NC,Catawba,28650,35.58,-81.13
-81.0909502,35.5889953,22921,1801,"Bandys Crossroads Volunteer Fire Department, Incorporated",3,4849 NC 16 Hwy S,Maiden,NC,Catawba,28650,35.59,-81.09
-81.87045324,36.16134725,22922,601,"Banner Elk Volunteer Fire Rescue, Inc.",1,345 Shawneehew Ave,Banner Elk,NC,Avery,28604,36.16,-81.87
-81.84995557,36.13409098,22923,601,"Banner Elk Volunteer Fire Rescue, Inc.",2,256 Norwood Hollow Rd,Banner Elk,NC,Avery,28604,36.13,-81.85
-80.57024291,36.48928758,22924,8675,"Bannertown Volunteer Fire Department, Inc.",1,124 Reeves Mill Road,Mount Airy,NC,Surry,27030,36.49,-80.57
-80.55690099,36.46467098,22925,8675,"Bannertown Volunteer Fire Department, Inc.",2,413 Holly Springs Road,Mount Airy,NC,Surry,27030,36.46,-80.56
-82.44961609,35.77379524,22926,1102,"Barnardsville Volunteer Fire Department, Incorporated",1,100 Dillingham Road,Barnardsville,NC,Buncombe,28709,35.77,-82.45
-82.29115708,35.45294269,22927,4501,"Bat Cave Volunteer Fire and Rescue Department, Inc.",1,267 Gerton Highway,Bat Cave,NC,Henderson,28710,35.45,-82.29
-76.8065,35.4761,22928,702,"Bath Volunteer Fire Department, Inc.",1,430 Carteret St.,Bath,NC,Beaufort,27808,35.48,-76.81
-77.75297125,36.04859542,22929,6402,"Battleboro Rural Fire Department, H. L. Harrison Fire District, Inc.",1,4909 Hathaway St.,Battleboro,NC,Nash,27809,36.05,-77.75
-78.41595633,34.6879,22930,915,"Bay Tree Lakes Volunteer Fire Department, Inc.",1,12717 NC Hwy 41 E,Harrells,NC,Bladen,28444,34.69,-78.42
-77.1226751,35.77143928,22931,5901,"Bear Grass Fire Rescue, Inc.",1,6005 Bear Grass Road,Williamston,NC,Martin,27892,35.77,-77.12
-78.40033988,36.2766519,22932,9101,"Bearpond Rural Fire Department, Inc.",1,325 Bear Pond Road,Henderson,NC,Vance,27537,36.28,-78.40
-76.65660956,34.71703606,22933,1654,Beaufort Fire Dept.,1,506 Liveoak St,Beaufort,NC,Carteret,28516,34.72,-76.66
-76.67778081,34.81483235,22934,1654,Beaufort Fire Dept.,2,2731 Highway 101,Beaufort,NC,Carteret,28516,34.81,-76.68
-78.59819,34.915636,22935,2629,Beaver Dam Volunteer Fire Department of Cumberland County,1,11042 NC Hwy 210 S,Roseboro,NC,Cumberland,28382,34.92,-78.60
-78.655368,34.873808,22936,2629,Beaver Dam Volunteer Fire Department of Cumberland County,2,9236 Turnbull Rd.,Fayettville,NC,Cumberland,28312,34.87,-78.66
-81.84946437,36.295653,22937,9509,"Beaver Dam Volunteer Fire Department of Watauga County, Inc.",1,1928 Bethel Road,Sugar Grove,NC,Watauga,28679,36.30,-81.85
-80.36408542,34.9886758,22938,9003,"Beaver Lane Volunteer Rescue & Fire Department, Inc.",1,310 Olive Branch Road,Marshville,NC,Union,28103,34.99,-80.36
-82.5318,35.6418,22939,1103,"Beaverdam Volunteer Fire Department, Incorporated",1,450 Beaverdam Road,Asheville,NC,Buncombe,28804,35.64,-82.53
-80.0997,36.08608,22940,3401,"Beeson Cross Roads Fire and Rescue, Inc.",1,1105 Old Salem Road,Kernersville,NC,Forsyth,27284,36.09,-80.10
-80.0842105,36.22630484,22941,3402,"Belews Creek Volunteer Fire and Rescue Department, Inc.",1,7675 Belew's Creek Road,Belews Creek,NC,Forsyth,27009,36.23,-80.08
-77.981,35.4353,22942,9603,"Belfast Volunteer Fire Fighters, Inc.",1,3212 US 117 Hwy. N,Goldsboro,NC,Wayne,27530,35.44,-77.98
-77.23495364,34.8868824,22943,6703,"Belgrade Volunteer Fire Department, Inc.",1,7561 New Bern Hwy,Maysville,NC,Jones,28555,34.89,-77.23
-76.6238835,35.53975675,22944,703,Belhaven Fire & Rescue Department,1,245 Haslin Street,Belhaven,NC,Beaufort,27810,35.54,-76.62
-77.51299079,35.59115202,22945,7452,"Bell Arthur Fire Dept., Inc.",1,2634 Fire House Rd,Bellarthur,NC,Pitt,27811,35.59,-77.51
-84.0753,34.9987,22946,2009,"Bellview Volunteer Fire Department, Inc.",1,1390 Lance Road,Murphy,NC,Cherokee,28906,35.00,-84.08
-81.03507854,35.23589279,22947,3603,Belmont Fire Department,1,301 Keener Boulevard,Belmont,NC,Gaston,28012,35.24,-81.04
-81.02153045,35.18660877,22948,3603,Belmont Fire Department,2,2300 South Point Road,Belmont,NC,Gaston,28012,35.19,-81.02
-77.46657469,35.70872614,22949,7413,"Belvoir Volunteer Fire Department, Inc.",1,4189 NC 33 West,Greenville,NC,Pitt,27834,35.71,-77.47
-79.11080688,35.36283124,22950,4316,"Benhaven Emergency Services, Inc.",1,4023 NC Hwy 87,Sanford,NC,Harnett,27332,35.36,-79.11
-79.04808542,35.34183501,22951,4316,"Benhaven Emergency Services, Inc.",2,722 Barbecue Church Rd,Sanford,NC,Harnett,27332,35.34,-79.05
-79.5426892,35.56409018,22952,1901,"Bennett Fire Department, Inc.",1,55 East Raleigh St.,Bennett,NC,Chatham,27208,35.56,-79.54
-79.46631149,35.56572254,22953,1901,"Bennett Fire Department, Inc.",2,20191 HWY 902,Bear Creek,NC,Chatham,27207,35.57,-79.47
-78.5478295,35.37738628,22954,5103,Benson Fire Department,1,313 South Elm St.,Benson,NC,Johnston,27504,35.38,-78.55
-78.27964636,35.32021617,22955,5105,"Bentonville Volunteer Fire Department, Inc.",1,3167 Harper House Rd ,Four Oaks,NC,Johnston,27524,35.32,-78.28
-81.28561073,35.28582261,22956,3604,Bessemer City Volunteer Fire Department,1,119 West Washington Street,Bessemer City,NC,Gaston,28016,35.29,-81.29
-80.20250729,35.39848746,22957,8404,"Bethany Community Fire Department, Incorporated",1,118 Bethany Church Rd,Albemarle,NC,Stanly,28001,35.40,-80.20
-78.21318775,35.63176512,22958,5104,"Bethany Rural Fire Department of Johnston County, Inc.",1,8525 Old Beulah Rd,Kenly,NC,Johnston,27542,35.63,-78.21
-78.69530845,35.06287663,22959,2601,"Bethany Rural Fire Department, Inc.",1,2140 Wade-Stedman Rd,Stedman,NC,Cumberland,28391,35.06,-78.70
-76.4793,36.1117,22960,7201,"Bethel Community Fire Protection Association, Inc.",1,462 Snug Harbor Road,Hertford,NC,Perquimans,27944,36.11,-76.48
-77.3746705,35.80764127,22961,7421,Bethel Fire & Rescue Department,1,3826 James St,Bethel,NC,Pitt,27812,35.81,-77.37
-81.3090919,35.84356958,22962,201,"Bethlehem Community Fire & Rescue, Inc.",1,7373 NC Hwy 127,Taylorsville,NC,Alexander,28681,35.84,-81.31
-81.4118,35.216401,22963,2301,"Bethlehem Volunteer Fire Department, Inc.",1,1128 Bethlehem Road,Kings Mountain,NC,Cleveland,28086,35.22,-81.41
-77.77783947,34.92560324,22964,3102,"Beulaville Volunteer Fire Department, Inc.",1,205 N. Wilson St. ,Beulaville,NC,Duplin,28518,34.93,-77.78
-78.97851573,34.80237887,22965,7802,"Big Marsh Volunteer Fire Department of Robeson County, Inc.",1,456 S Fifth St.,Saint Pauls,NC,Robeson,28384,34.80,-78.98
-82.7993,35.8024,22966,5805,"Big Pine Volunteer Fire Department, Inc.",1,7909 Big Pine Road,Marshall,NC,Madison,28753,35.80,-82.80
-82.151019,35.448794,22967,8114,Bills Creek Community Volunteer Fire Dept. Inc.,1,1184 Bill Creek Rd,Lake Lure,NC,Rutherford,28746,35.45,-82.15
-82.1368,35.4823,22968,8114,Bills Creek Community Volunteer Fire Dept. Inc.,2,336 Cedar Creek Road,Lake Lure,NC,Rutherford,28746,35.48,-82.14
-79.7820751,35.36026876,22969,6203,Biscoe Fire Department,1,110 W. Main Street,Biscoe,NC,Montgomery,27209,35.36,-79.78
-77.936149,35.63775,22970,9801,"Black Creek Volunteer Fire Department, Inc.",1,114 N Church Street,Black Creek,NC,Wilson,27813,35.64,-77.94
-77.24776361,35.50025217,22971,7435,"Black Jack Volunteer Fire Department, Inc.",1,3020 Black Jack Grimesland Rd,Greenville,NC,Pitt,27858,35.50,-77.25
-82.3210579,35.61893548,22972,1105,"Black Mountain Fire Department, Incorporated",1,106 Montreat Road,Black Mountain,NC,Buncombe,28711,35.62,-82.32
-82.33586397,35.60465108,22973,1105,"Black Mountain Fire Department, Incorporated",2,19 White Pine Drive,Black Mountain,NC,Buncombe,28711,35.60,-82.34
-82.36905516,35.66846997,22974,1105,"Black Mountain Fire Department, Incorporated",3,49 Wedgewood Terrace,Black Mountain,NC,Buncombe,28711,35.67,-82.37
-78.43608239,35.3667594,22975,5106,"Blackman's Crossroads Volunteer Fire Department, Inc.",1,5813 NC 96 S,Four Oaks,NC,Johnston,27524,35.37,-78.44
-78.79114939,34.54122584,22976,901,Bladenboro Fire Department,1,519 West Seaboard Street,Bladenboro,NC,Bladen,28320,34.54,-78.79
-76.94917358,35.37012625,22977,709,"Blounts Creek Volunteer Fire Department, Inc.",1,13965 NC Highway 33 East,Blounts Creek,NC,Beaufort,27814,35.37,-76.95
-81.67088775,36.13010763,22978,9502,Blowing Rock Fire & Rescue,1,8001 Valley Blvd,Blowing Rock,NC,Watauga,28605,36.13,-81.67
-81.74813649,36.12057732,22979,9502,Blowing Rock Fire & Rescue,2,6165 US Hwy 221 S,Blowing Rock,NC,Watauga,28605,36.12,-81.75
-81.6216,36.16055,22980,9502,Blowing Rock Fire & Rescue,3,2409 Aho Road,Blowing Rock,NC,Watauga,28605,36.16,-81.62
-77.1085,35.9996,22981,813,"Blue Jay Volunteer Fire Company, Inc.",1,1653 Indianwoods Rd,Windsor,NC,Bertie,27983,36.00,-77.11
-82.4212414,35.29023432,22982,4502,"Blue Ridge Fire & Rescue, Inc.",1,2503 Old Spartanburg Road,East Flat Rock,NC,Henderson,28726,35.29,-82.42
-82.44080688,35.274,22983,4502,"Blue Ridge Fire & Rescue, Inc.",2,77 Village Center Drive,Flat Rock,NC,Henderson,28731,35.27,-82.44
-78.06820268,34.03184001,22984,1001,Boiling Spring Lakes Fire Rescue,1,3059 George II Hwy ,Southport,NC,Brunswick,28461,34.03,-78.07
-78.03118735,34.06465777,22985,1001,Boiling Spring Lakes Fire Rescue,2,2440 Frink Lake DR,Southport,NC,Brunswick,28461,34.06,-78.03
-78.03550268,34.02854674,22986,1001,Boiling Spring Lakes Fire Rescue,3,900 Fifty Lakes Dr,Southport,NC,Brunswick,28461,34.03,-78.04
-81.6653,35.2501,22987,2302,Boiling Springs City Fire Department,1,114 E. College St.,Boiling Springs,NC,Cleveland,28017,35.25,-81.67
-81.667272,35.253572,22988,2304,Boiling Springs Fire and Rescue,1,149 N. Main St.,Boiling Springs,NC,Cleveland,28017,35.25,-81.67
-81.7148,35.1856,22989,2304,Boiling Springs Fire and Rescue,2,2479 McCraw Road,Mooresboro,NC,Cleveland,28114,35.19,-81.71
-78.1494,34.065666,22990,1002,Bolivia Volunteer Fire Department,1,3848 Old Ocean Hwy,Bolivia,NC,Brunswick,28422,34.07,-78.15
-78.40740688,34.31984683,22991,2402,"Bolton Volunteer Fire and Rescue Department, Inc.",1,225 9th St.,Bolton,NC,Columbus,28423,34.32,-78.41
-79.41777551,35.645539,22992,1902,"Bonlee Fire Department, Inc.",1,185 Bonlee Bennett Rd,Bonlee,NC,Chatham,27213,35.65,-79.42
-81.2677502,36.05717806,22993,9702,"Boomer Volunteer Fire Department, Inc.",1,5990 S. NC 18 Hwy.,Boomer,NC,Wilkes,28606,36.06,-81.27
-81.68519697,36.21917882,22994,9503,Boone Fire Department,1,721 West King Street,Boone,NC,Watauga,28607,36.22,-81.69
-81.65336321,36.20258316,22995,9503,Boone Fire Department,2,1075 State Farm Road,Boone,NC,Watauga,28607,36.20,-81.65
-81.60665708,36.19583549,22996,9503,Boone Fire Department,3,3228 Bamboo Road,Boone,NC,Watauga,28607,36.20,-81.61
-78.9361,35.4202,22997,4317,"Boone Trail Emergency Services, Inc.",1,7016 US 421 N,Lillington,NC,Harnett,27546,35.42,-78.94
-79.0252,35.4372,22998,4317,"Boone Trail Emergency Services, Inc.",2,12140 US 421 N,Broadway,NC,Harnett,27505,35.44,-79.03
-80.51756532,35.56103166,22999,8041,"Bostian Heights Fire Department, Inc.",1,8211 Old Concord Rd,Salisbury,NC,Rowan,28146,35.56,-80.52
-81.83622915,35.36336377,23000,8101,Bostic Volunteer Fire Department,1,181 North Main Street,Bostic,NC,Rutherford,28018,35.36,-81.84
-82.267749,36.036008,23001,6106,"Bradshaw Volunteer Fire and Rescue, Inc.",1,4256 NC 197 Hwy,Green Mountain,NC,Mitchell,28740,36.04,-82.27
-78.55283603,36.10729535,23002,3914,Brassfield Volunteer Fire Department,1,1680 NC Hwy 96 ,Franklinton,NC,Granville,27525,36.11,-78.55
-81.78048542,35.64248203,23003,1275,"Brendletown Fire Protection and Rescue Association, Inc.",1,5157 US Hwy 64,Morganton,NC,Burke,28655,35.64,-81.78
-81.7828,35.65974359,23004,1275,"Brendletown Fire Protection and Rescue Association, Inc.",2,3646 Bennet Road,Morganton,NC,Burke,28655,35.66,-81.78
-82.7365,35.2344,23005,8802,Brevard Fire Dept.,1,95 West Main Street,Brevard,NC,Transylvania,28712,35.23,-82.74
-78.96177048,34.5474265,23006,7803,"Britts Township Volunteer Fire Department, Inc.",1,9529 NC 72 E,Lumberton,NC,Robeson,28358,34.55,-78.96
